NPI Number,Hospital Name,IDN
1053332213,BayPointe Hospital,AltaPointe Health Systems
1124283502,Mackinac Straits Health System,
1134152234,PAM Health Specialty Hospital of Dayton (FKA LifeCare Hospitals of Dayton),PAM Health (FKA Post Acute Medical)
1225035462,Kindred Hospital Rome (Closed),Kindred Healthcare (Closed)
1417035536,Munising Memorial Hospital,
1326190471,Sgt John L Levitow Veterans Health Center (AKA Rocky Hill Veterans Home - Closed),
1124117205,Grace Hospital - Fairview (Closed),Grace Hospital System
1861475626,Parmer Medical Center,Preferred Management Healthcare Specialists
1972597219,Missouri Rehabilitation Center (Closed 2014-10-31),University of Missouri Health Care (AKA MU Health Care)
1508027624,Vibra Hospital of Southeastern Michigan (Closed),Vibra Healthcare
1730139031,Memorial Hospital,UnityPoint Health (FKA Iowa Health System)
1023082716,Summit Behavioral Healthcare Hospital,Ohio Department of Mental Health & Addiction Services
1164863676,Select Specialty Hospital - Richmond (FKA Vibra Hospital of Richmond),Select Medical Corporation
1700949336,Valley Childrens Hospital (FKA Childrens Hospital Central California),
1306870910,St Lukes Behavioral Health Center,Steward Health Care System
1447336508,Transitions Behavioral Health (Closed),
1831103449,Sanford Webster Medical Center,Sanford Health
1386708550,Rockland Psychiatric Center,New York State Office of Mental Health
1649277732,Asheville Specialty Hospital,HCA North Carolina Division (AKA Mission Health System)
1144227935,Trinity Medical (FKA Riverland Medical Center),
1295767333,Lakeland Specialty Hospital (Closed 2015-06-01),Corewell Health South (FKA Spectrum Health Lakeland)
1538252721,St Catherines Rehabilitation Hospital,Catholic Health Services
1477549111,CHI Mercy Health of Valley City,CHI Health (FKA Alegent Creighton Health)
1538301981,First Hospital (Closed 2022-10-30),Commonwealth Health
1760424261,Kentfield Hospital,Vibra Healthcare
1073572590,KPC Promise Hospital of Phoenix (FKA Promise Hospital of Phoenix),KPC Group (AKA KPC Healthcare)
1407900095,UCSF Langley Porter Psychiatric Hospital,University of California San Francisco Health System (AKA UCSF Health)
1801957667,Incline Village Community Hospital,Tahoe Forest Health System (FKA Tahoe Forest Hospital District)
1184731804,Arizona State Hospital,
1790768471,Warren State Hospital,
1861576993,UPMC Williamsport Divine Providence Campus (FKA Williamsport Regional Medical Center - Divine Providence Campus),UPMC in North Central Pennsylvania (FKA UPMC Susquehanna)
1811056898,Shodair Childrens Hospital,
1801805502,Baptist Memorial Restorative Care Hospital,Baptist Memorial Health Care Corporation
1932294071,George C Grape Community Hospital,
1538108998,Sheltering Arms Hospital - Mechanicsville (FKA Hanover Campus & Hanover Hospital - Closed),
1497706659,Highland Hospital (FKA Highland - Charleston Hospital),Summit BHC
1558388470,Bethesda Rehabilitation Hospital,
1609870310,Excelsior Springs Hospital,
1104863331,ContinueCARE Hospital at Palmetto Health Baptist (FKA Intermedical Hospital of South Carolina),Community Hospital Corporation ContinueCARE
1306928213,Pulaski Memorial Hospital,
1174673636,Vibra Hospital of Fort Wayne (Closed),Vibra Healthcare
1801824305,Bellin Health Psychiatric Center,Bellin Health
1053319566,Riverview Psychiatric Hospital,
1295726156,Arkansas State Hospital,
1649252321,North Oaks Rehabilitation Hospital,North Oaks Health System
1629053087,St Lawrence Rehabilitation Center,
1851393409,Madison Parish Hospital,
1598099814,The Rehabilitation Institute of Ohio (FKA Encompass Health Rehabilitation Hospital of Dayton),Encompass Health Corporation (FKA HealthSouth)
1760623888,Centennial Peaks Hospital,Universal Health Services
1790702371,Yoakum County Hospital,
1356418974,Throckmorton County Hospital,
1851346407,University Behavioral Health of Denton,Universal Health Services
1598785388,Rehabilitation Hospital of the Pacific,
1578590626,Appleton Area Health Services,
1649221680,Rehabilitation Hospital of Fort Wayne,Select Medical Corporation
1295862647,Unity Health - Advanced Care Hospital,Unity Health
1831413186,Mohawk Valley Psychiatric Center,New York State Office of Mental Health
1750353843,North Alabama Regional Hospital (Closed 2015-06-01),Alabama Department of Mental Health
1548355811,Franklin County Medical Center,
1013941780,Covenant Specialty Hospital,Covenant Health (TX)
1417979204,Brentwood Hospital,Universal Health Services
1548214786,Cornerstone Specialty Hospitals Huntington,Cornerstone Healthcare Group
1306845482,Select Specialty Hospital - Durham,Select Medical Corporation
,Fayetteville City Hospital and Geriatric Center (Closed),
1366874877,St Lukes Jerome Medical Center (FKA St Benedicts Family Medical Center),St Lukes Health System (Boise ID)
1386626919,Allentown State Hospital (Closed 2010-12-15),
1518980978,Cornerstone Specialty Hospitals Muskogee,Cornerstone Healthcare Group
1194816074,Griffin Memorial Hospital,Oklahoma Department of Mental Health
1164506317,Hale Ho Ola Hamakua (FKA Honoka a Hospital),Hawaii Health Systems Corp (AKA HHSC)
1891727475,Sierra Providence Physical Rehab (Closed 2009-01-01),Tenet Healthcare
1598740821,Levindale Hebrew Geriatric Center & Hospital (AKA Levindale),LifeBridge Health
1932116340,Montana State Hospital,
1326025701,Concho County Hospital,
1447252044,Regency Hospital of Macon (AKA Regency Macon),Select Medical Corporation
1841290764,Select Specialty Hospital - Kansas City,Select Medical Corporation
,Kindred Hospital San Angelo (Closed 2008-01-01),Kindred Healthcare (Closed)
1609894716,Ellett Memorial Hospital,
1598710097,I-70 Community Hospital (Closed),HMC/CAH Consolidated (FKA Rural Community Hospitals of America - Closed)
1073901476,Cornerstone Specialty Hospitals Conroe,Cornerstone Healthcare Group
1548267339,Noland Hospital Montgomery (Closed),Noland Health Services
1487638441,Brentwood Behavioral Healthcare,Universal Health Services
1730278417,Texas Health Specialty Hospital,Texas Health Resources
1225079833,Hospital District 6 - Anthony Campus (Closed),Hospital District #6 (AKA HD6)
1013075167,Regency Hospital of North Dallas (Closed),
1952307811,Select Specialty Hospital - Atlanta (Closed),Select Medical Corporation
1932143989,Perry County General Hospital,Forrest Health
1174678460,University Pediatric Hospital,
1770742132,Riverwoods Behavioral Health System,Acadia Healthcare
1588664007,Select Specialty Hospital - Savannah,Select Medical Corporation
,West Florida Community Care Center (Closed),
1508840844,Norwood Health Center,
1427360338,Choctaw County Medical Center (Closed),
1043240351,Bariatric Care Centers of Penn (Closed),
1609046671,North Canyon Medical Center,
1609874932,Power County Memorial Hospital (FKA Harms Memorial Hospital),
1700959905,Southeast Rehab LLC,
1366874620,PAM Specialty Hospital of Corpus Christi South (FKA Kindred Hospital Corpus Christi - Closed),PAM Health (FKA Post Acute Medical)
1104895325,Sunrise Haven,
1568526739,New York State Psychiatric Institute,New York State Office of Mental Health
1962614834,Austin Lakes Hospital (Closed),Universal Health Services
1932154796,Specialty Hospital,LHC Group
1396093613,Buttonwood Behavioral Health Hospital,
1295764553,Schleicher County Medical Center,Preferred Management Healthcare Specialists
1649224320,Fort Lauderdale Behavioral Health Center (AKA Fort Lauderdale Hospital),Universal Health Services
1962457861,Norman Specialty Hospital (Closed),
1902863418,Vista Del Mar Hospital,Aurora Behavioral Health Care
1053342220,Havenwyck Hospital,Universal Health Services
1326133216,Highlands Behavioral Health System,Universal Health Services
1851381990,Adventist Health Vallejo,Adventist Health (AKA Adventist Health System/West)
1649243353,Encompass Health Rehabilitation Hospital of Texarkana (FKA Healthsouth Rehab of Texarkana),Encompass Health Corporation (FKA HealthSouth)
1225001936,Encompass Health Rehabilitation Hospital of Concord (FKA HealthSouth Rehabilitation Hospital of Concord),Encompass Health Corporation (FKA HealthSouth)
1437187044,Bennett County Hospital,
1598738296,Encompass Health Rehabilitation Hospital of Florence (FKA Healthsouth Rehabilitation Hospital of Florence),Encompass Health Corporation (FKA HealthSouth)
1821062050,Encompass Health Rehabilitation Hospital of Arlington (FKA Healthsouth Rehab of Arlington),Encompass Health Corporation (FKA HealthSouth)
1235437401,Encompass Health Rehabilitation Hospital of Miami (FKA Healthsouth Rehab Hospital of Miami),Encompass Health Corporation (FKA HealthSouth)
1467426304,Encompass Health Rehabilitation Hospital of Panama City (FKA Healthsouth Emerald Coast Rehabilitation Hospital),Encompass Health Corporation (FKA HealthSouth)
1306819008,Encompass Health Rehabilitation Hospital of Largo (FKA Healthsouth Rehabilitation Hospital of Largo),Encompass Health Corporation (FKA HealthSouth)
1386652725,Pembroke Hospital (FKA Arbour - Pembroke Hospital),Universal Health Services
1871566018,Timberlawn Mental Health System (Closed),Universal Health Services
1467505073,Nemours Childrens Hospital - Delaware (FKA Nemours Alfred I duPont Hospital for Children),Nemours Childrens Health System
1518937218,River Crest Hospital,Universal Health Services
1649251554,Garnet Health Medical Center - Callicoon Campus (FKA Catskill Regional Medical Center - Grover M Hermann Hospital),Garnet Health (FKA Greater Hudson Valley Health System)
1891728192,OConnor Hospital,Bassett Healthcare
1235184649,Clifton-Fine Hospital,
1568540607,Stony Lodge Hospital (Closed 2012-01-01),
1700968492,Schwab Rehabilitation Hospital (FKA Schwab Rehab Hospital & Care Network),Sinai Health System
1285662981,Trinity Health Shelby Hospital (FKA Mercy Health Lakeshore Campus),Trinity Health Michigan
1093046005,East Central Regional Hospital,Georgia Department of Behavioral Health and Developmental Disabilities (AKA Central State Hospital - System)
1770580581,Noland Hospital Birmingham East,Noland Health Services
1043264351,Northlake Behavioral Health System (FKA Southeast Louisiana State Hospital),
1538465901,Baylor Scott & White Institute for Rehabilitation - Dallas,Baylor Scott & White Health
1457330995,South Mississippi State Hospital,Mississippi Department of Mental Health
1598818403,Aspirus Ontonagon Hospital,Aspirus Health (FKA Community Health Care Inc)
1588614036,St Helena Parish Hospital,
1740251313,Forest View Hospital,Universal Health Services
1093712697,South Texas Rehabilitation Hospital,Ernest Health
1407299662,PAM Health Specialty Hospital of Denver (FKA Colorado Acute Long Term Hospital),PAM Health (FKA Post Acute Medical)
1104069830,Meadowcrest Specialty Hospital (Closed),
1962841197,PAM Specialty Hospital of Lafayette (FKA Kindred Hospital Lafayette - Closed),PAM Health (FKA Post Acute Medical)
1083612121,Stonewall Memorial Hospital,
1689744450,Childrens Egleston Hospital (FKA Childrens Healthcare Egleston),Childrens Healthcare of Atlanta
1457324162,Encompass Health Rehabilitation Hospital of Treasure Coast (FKA Healthsouth of Treasure Coast),Encompass Health Corporation (FKA HealthSouth)
1225037294,Select Specialty Hospital - Erie,Select Medical Corporation
1831550680,PAM Rehabilitation Hospital of Beaumont (FKA Healthsouth Southeast Texas Rehabilitation Hospital),PAM Health (FKA Post Acute Medical)
1912971854,Encompass Health Rehabilitation Hospital of Western Massachusetts (FKA Healthsouth Rehabilitation Hospital of Western Massachusetts),Encompass Health Corporation (FKA HealthSouth)
1548407216,Regional Health Systems Care Center - Merrillville (FKA Regional Mental Health Strawhun Center for Mental Center),Regional Health Systems
1811048614,Mercy Rehabilitation Hospital St Louis (FKA St Johns Mercy Rehabilitation Hospi),Mercy (MO)
1609062181,Community Specialty Hospital (Closed),
1932117173,Parkland Health Center - Bonne Terre,BJC HealthCare
1023015120,Millwood Hospital,Universal Health Services
1366597650,Trinity Health Kenmare Hospital (FKA Trinity Kenmare Community Hospital),Trinity Health (ND)
1467453902,CHRISTUS St Michael Rehabilitation Hospital,CHRISTUS St Michael Health System
1538264866,Ascension Seton Shoal Creek (FKA Seton Shoal Creek Hospital),Ascension Seton (AKA Seton Healthcare Family)
1407049877,Jenkins Community Hospital (Closed 2009-01-01),
1750482022,Childrens Wisconsin (FKA Childrens Hospital of Wisconsin - Milwaukee Campus),Childrens Hospital of Wisconsin (FKA Childrens Health System)
1790952760,San Diego Hospice Acute (Closed 2013-01-01),
1063414886,Regency Hospital of Northwest Indiana (AKA Regency Northwest Indiana),Select Medical Corporation
1538277637,Choate Mental Health Center,Illinois Department of Human Services
1043961378,Gulf Coast Treatment Center,Universal Health Services
1902903487,Madden Mental Health Center,Illinois Department of Human Services
1073682001,PAM Health Specialty Hospital at Heritage Valley (FKA CuraHealth Hospital - Heritage Valley),PAM Health (FKA Post Acute Medical)
1023019718,Douglas County Community Mental Health Center (FKA Douglas County Hospital),
1427002070,Atlantic Shores Hospital (Closed),Universal Health Services
1235226416,AMG Specialty Hospital - Edmond (FKA LTAC of Edmond - Closed),AMG Integrated Healthcare Management
,Select Specialty Hospital - Arizona (Closed),Select Medical Corporation
1821024563,Vermilion Behavioral Health System,Vermilion Behavioral Health Systems
1467407395,Oaklawn Psychiatric Center,
1831218601,Royal Oaks Hospital,
1215902168,Fairmount Behavioral Health System (FKA Fairmount Hospital),Universal Health Services
1750620456,Oceans Behavioral Hospital Abilene,Oceans Healthcare
1619072493,Community Fairbanks Recovery Center (FKA Fairbanks),Community Health Network (Indianapolis IN)
1952649147,Acadia Vermilion Hospital - South Campus (FKA Optima Specialty Hospital),Vermilion Behavioral Health Systems
1801872379,Kindred Hospital Detroit (Closed),Kindred Healthcare (Closed)
1942257423,Sterlington Rehabilitation Hospital,
1053470047,Meadowview Psychiatric Hospital,
1649278854,Rooks County Health Center,
1588965305,AMG Specialty Hospital - Wichita (FKA LTAC of Wichita - Closed),AMG Integrated Healthcare Management
1326118597,Specialty Hospital of Lorain,Grace Hospital System
1043280951,Laurel Ridge Treatment Center,Universal Health Services
1184089054,Pine Valley Specialty Hospital (FKA Promise Hospital of Houston - Closed),Concord Healthcare Group (Closed)
1346671849,KPC Promise Hospital of Wichita Falls (FKA Promise Hospital of Wichita Falls),KPC Group (AKA KPC Healthcare)
1023451077,LifeCare Hospital of Dallas,LifeCare
1720003643,Conway Regional Rehabilitation Hospital,Conway Regional Health System
1598716490,Cedar Ridge Behavioral Hospital,Universal Health Services
1437105574,Landmark Hospital of Cape Girardeau,Landmark Hospitals
1467836981,Iberia Rehabilitation Hospital (Teche Specialty Hospital - Closed),
1013931765,Northeast Florida State Hospital,Florida Department of Children and Families
1891718375,Aultman Orrville Hospital (FKA Dunlap Memorial Hospital),Aultman Health Foundation
1407207632,BridgePoint Continuing Care Hospital - New Orleans (FKA Kindred Hospital West Jefferson Hospital - Marrero),BridgePoint Healthcare (FKA Specialty Hospitals of Washington)
1093774762,Stevens County Hospital,
1689614927,Weisman Childrens Rehabilitation Hospital,
1154324952,Liberty - Dayton Community Hospital (AKA Liberty Dayton Regional Medical Center),
1548495740,CHRISTUS Dubuis Hospital of Paris (FKA Dubuis Health System - Paris - Closed),CHRISTUS Dubuis Health System (AKA CHRISTUS Continuing Care)
1982672762,Pine Rest Christian Mental Health Services (AKA Pine Rest Christian Hospital),
1629161781,Childrens Hospital and Clinics of Minnesota - St Paul,Childrens Minnesota
1902879620,Encompass Health Rehabilitation Hospital of Nittany Valley (FKA Healthsouth Nittany Valley Rehabilitation Hospital),Encompass Health Corporation (FKA HealthSouth)
1366520884,Kindred Hospital Las Vegas - Sahara,ScionHealth
1629039193,Riverside Hospital of Louisiana,Priority Hospital Group
1639254121,Kindred Hospital - Louisville,ScionHealth
1548360696,Louisiana Extended Care Hospital of Lafayette,LHC Group
1427127463,Kindred Hospital Chattanooga,ScionHealth
1841292604,St James Hospital (Closed 2008-01-01),
1326071416,Excela Health Westmoreland Hospital at Jeannette (Closed 2011-01-01),Excela Health (Closed - Merged with Independence Health System)
1568473940,Mesa General Hospital (Closed 2008-06-01),
1447439708,Baptist Health Extended Care Hospital,Baptist Health (AR)
1902910490,Lincoln Park Hospital (Closed 2008-01-01),
,Kindred Hospital Modesto (Closed 2009-01-01),Kindred Healthcare (Closed)
1114085826,Beatrice State Development Center (Closed - Now Residential Treatment Facility),Nebraska Department of Health & Human Services
1285764720,Endeavor Seniorcare Hospital LLC (Closed 2008-06-01),
1760822803,Vibra Hospital of Central Dakotas (FKA Kindred Hospital Central Dakotas),Vibra Healthcare
1396726873,Lakeview Specialty Hospital & Rehab,
1528622065,Intensive Specialty Hospital - Shreveport Campus (FKA Promise Hospital of Louisiana),Intensive Specialty Hospital
1881751139,Oceans Behavioral Hospital Lake Charles,Oceans Healthcare
1982110458,PAM Health Specialty Hospital of Jacksonville (FKA CuraHealth - Jacksonville),PAM Health (FKA Post Acute Medical)
1831123819,LifeCare Hospitals of Wisconsin (Closed),LifeCare Health Partners (Closed)
1578559340,Camden County Health Services Center (Closed),Oceans Healthcare
1235387044,Ascension Saint Thomas Three Rivers (FKA Three Rivers Hospital),Ascension Saint Thomas (FKA Saint Thomas Health)
,Select Specialty Hospital - Macomb,Select Medical Corporation
1528063435,Specialty Hospital at Monmouth (Closed - Consolidated with Specialty Hospital of NJ),AcuteCare Health System
1114991874,Encompass Health Rehabilitation Hospital of Henderson (FKA Healthsouth Rehabilitation Hospital of Henderson),Encompass Health Corporation (FKA HealthSouth)
1437188505,Oceans Behavioral Hospital Baton Rouge,Oceans Healthcare
1982647103,South Davis Community Hospital,South Davis Community Hospital (SDCH)
1396901260,Cambridge Behavioral Hospital (Closed),Oglethorpe Inc
1467538009,Lakeshore Mental Health Institute (Closed 2012-06-01),
1043395742,Kindred Hospital Ontario,ScionHealth
1225015985,HealthBridge Childrens Hospital - Orange,
1164507752,Kindred Hospital Central Tampa,ScionHealth
1881772713,Kindred Hospital - Greensboro,ScionHealth
1447335146,Kindred Hospital Los Angeles,ScionHealth
1215190707,Select Specialty Hospital - Canton,Select Medical Corporation
1962580803,Kindred Hospital New Jersey - Morris County,ScionHealth
1104825140,Select Specialty Hospital - Fort Wayne (Closed),Select Medical Corporation
1013970219,Lake Taylor Transitional Care Hospital,
1720162399,Continuing Care Hospital,CHI Saint Joseph Health (FKA KentuckyOne Health)
1225362973,River Bend Hospital (FKA Wabash Valley Hospital),
1992789101,State Hospital South,Idaho Department of Health and Welfare
1467853051,PAM Health Specialty Hospital of Corpus Christi North,PAM Health (FKA Post Acute Medical)
1609839208,ContinueCARE Hospital at Baptist Health Corbin,Community Hospital Corporation ContinueCARE
1205164928,Rice Medical Center,Critical Access Healthcare
1619092780,UT Health East Texas Specialty Hospital (AKA UT Health East Texas Long-Term Acute Care),UT Health East Texas (FKA East Texas Medical Center Regional Healthcare System)
1497857437,Roger Mills Memorial Hospital,
1598722027,Aurora San Diego Hospital,Aurora Behavioral Health Care
1720107519,Lincoln Community Hospital,
1063482735,Rivendell Behavioral Health Services - Arkansas,Universal Health Services
1407988892,Waukesha County Mental Health Center,
1942240189,Refugio County Memorial Hospital,
1619934114,Aurora Charter Oak Hospital,Aurora Behavioral Health Care
1033107826,IntraCare Behavioral Health North (Closed),
1164495867,Encompass Health Rehabilitation Hospital of Salisbury (FKA HealthSouth Chesapeake Rehabilitation Hospital),Encompass Health Corporation (FKA HealthSouth)
1043283757,MUSC Health Medical University of South Carolina Rehabilitation Hospital (FKA Encompass Health Rehabilitation Hospital of Charleston),Encompass Health Corporation (FKA HealthSouth)
1871566570,Encompass Health Rehabilitation Hospital of Huntington (FKA HealthSouth Rehabilitation Hospital of Huntington),Encompass Health Corporation (FKA HealthSouth)
1699740373,Encompass Health Rehabilitation Hospital of Spring Hill (FKA Healthsouth Rehab of Spring Hill),Encompass Health Corporation (FKA HealthSouth)
1164410288,Jennings Senior Care Hospital,Compass Health
1518938174,Human Resource Institute (AKA HRI Hospital),Universal Health Services
1356588644,Cornerstone Behavioral Health Hospital of Union County,
1720165327,Lakeland Behavioral Health System,Acadia Healthcare
1891796108,Bloomington Meadows Hospital,Universal Health Services
1629090493,Spring Grove Hospital Center,Maryland Department of Health
1518973379,Johnson Rehabilitation Institute at Ocean University Medical Center (FKA Shore Rehabilitation Institute),Hackensack Meridian Health
1538551791,Weslaco Regional Rehabilitation Hospital,Ernest Health
1255354288,Northeast Rehabilitation Hospital - Salem,Northeast Rehabilitation Hospital Network
1629037163,PAM Health Specialty Hospital of San Antonio (FKA Promise Specialty Hospital - San Antonio),PAM Health (FKA Post Acute Medical)
1598825044,Sheppard Pratt - Towson Campus (AKA Sheppard & Enoch Pratt Hospital),Sheppard Pratt Health System
1154407922,Encompass Health Rehabilitation Hospital of Petersburg (FKA Healthsouth Rehab of Petersburg),Encompass Health Corporation (FKA HealthSouth)
1013972272,Lake Butler Hospital (FKA Lake Butler Hand Surgery Center),
1144293705,San Juan Capestrano Hospital,Acadia Healthcare
1821202797,Cypress Psychiatric Hospital (Closed),
1053652438,Peak Behavioral Health,Summit BHC
1295840999,Stafford County Hospital,Great Plains Health Alliance (AKA GPHA)
1568419166,Quitman Community Hospital (AKA Quitman County Hospital),
1750307468,Sunland Home Foundation,
1972659696,High Ridge House,
1487868170,Haven Behavioral Hospital of Southern Colorado (Closed 2016-01-01),Haven Behavioral Healthcare
1144422650,Oceans Behavioral Hospital Desoto (FKA Stonewall Hospital for Behavioral Health - Closed),Oceans Healthcare
1013919620,Kessler Institute for Rehabilitation - West Orange,Kessler Institute for Rehabilitation
1760412126,Eastern Shore Hospital Center,Maryland Department of Health
1770585382,Regency Hospital of Minneapolis (AKA Regency Minneapolis),Select Medical Corporation
1033215504,Eastside Psychiatric Hospital,
1336146141,Noland Hospital Tuscaloosa,Noland Health Services
1942265327,Lincoln County Hospital,
1770515165,Bacharach Institute for Rehabilitation (Closed),
1841215985,Wellstone Regional Hospital,Universal Health Services
1912063280,Extended Care of Southwest Louisiana (Memorial Specialty Hospital - Closed),Lake Charles Memorial Health System
1770546020,Matheny Medical and Educational Center (FKA Matheny School & Hospital),
1740358878,Westboro State Hospital (Closed 2010-01-01),
1447233424,Clarks Summit State Hospital,
1407884059,Aspire Health Alliance (FKA South Shore Mental Health),
1366415085,Encompass Health Rehabilitation Hospital of Sewickley (FKA HealthSouth Rehabilitation Hospital of Sewickley),Encompass Health Corporation (FKA HealthSouth)
1528061827,MedStar National Rehabilitation Hospital,MedStar Health
1932168416,KPC Promise Hospital of Vicksburg (FKA Promise Hospital of Vicksburg),KPC Group (AKA KPC Healthcare)
1265413405,Woodlawn Hospital,
1306933692,Little River Healthcare - Rockdale Hospital (FKA Little River Healthcare - Richards Memorial Hospital - Closed),Little River Healthcare (Closed)
1609091693,Central Texas Rehabilitation Hospital,Ascension Seton (AKA Seton Healthcare Family)
1164512083,Quincy Valley Medical Center,
1245242486,Regional Hospital for Respiratory & Complex Care (AKA Regional Hospital - Closed - Merged with Highline Medical Center),Virginia Mason Franciscan Health (FKA CHI Franciscan Health)
1912965021,Providence St Elias Specialty Hospital,Providence Health & Services - Alaska
1295708683,Willapa Harbor Hospital,
1871549949,Psychiatric Institute of Washington,Universal Health Services
1760468623,Walter P Carter Center (Closed 2009-10-01),
1417016825,KidsPeace Childrens Hospital - Kidspeace Orchard Hills Campus,
1295709954,Yuma Rehabilitation Hospital,Encompass Health Corporation (FKA HealthSouth)
1972577815,Encompass Health Rehabilitation Hospital of Lakeview (FKA HealthSouth Lakeview Rehabilitation Hospital),Encompass Health Corporation (FKA HealthSouth)
1528154481,Mildred Mitchell-Bateman Hospital,West Virginia Bureau for Behavioral Health and Health Facilities
1295781227,Riceland Medical Center (FKA Winnie Community Hospital),
1679521868,Select Specialty Hospital - Madison,Select Medical Corporation
1982600680,Four Winds Westchester,Four Winds Hospitals
1265473110,Holliswood Hospital (Closed),
1619034154,Bronx Psychiatric Center,New York State Office of Mental Health
1053522987,Psychiatric Hospital of San Diego County,
1679541031,Circles of Care,
1740286616,Ashley Medical Center,
1780231563,PAM Health Specialty Hospital of San Antonio Medical Center (FKA LifeCare Hospitals of San Antonio),PAM Health (FKA Post Acute Medical)
1114916954,Ramapo Ridge Behavioral Health (FKA Ramapo Ridge Psychiatric Hospital),Christian Health
1093781544,Peachford Hospital,Universal Health Services
1679916530,Lifecare Health Partners of South Texas - South Campus (Closed 2017-06-01),LifeCare Health Partners (Closed)
1205935012,Childrens of Alabama,
1720084734,Columbus Specialty Hospital,
1811997919,Corpus Christi Specialty Hospital (Closed 2012-07-01),
1508258823,Cardinal Hill Rehabilitation Hospital,Encompass Health Corporation (FKA HealthSouth)
,Kindred Hospital Delaware County (Closed),Kindred Healthcare (Closed)
