NPI Number,Hospital Name,IDN
1386746592,Jefferson Stratford Hospital (FKA Kennedy University Hospital - Stratford),Jefferson Health - New Jersey (FKA Kennedy Health System)
1235134024,Virtua Our Lady of Lourdes Hospital,Virtua Health
1326552613,Virtua Berlin Outpatient Center (Closed - No Longer Offers Inpatient Services),Virtua Health
1568442309,Cooper University Hospital (AKA Cooper University Health Care),
1053382697,Cape Regional Health System (AKA Cape Regional Medical Center),
1164487542,Inspira Medical Center Vineland (FKA South Jersey Healthcare Regional Medical Center),Inspira Health Network (FKA South Jersey Healthcare)
1801845664,East Orange VA Medical Center,VA New York/New Jersey VA Health Care Network - VISN 2 (FKA VA Health Care Upstate New York)
1215027966,Newark Beth Israel Medical Center,RWJBarnabas Health
1902901333,Clara Maass Medical Center,RWJBarnabas Health
1013386143,CareWell Health Medical Center (FKA East Orange General Hospital),
1396857488,Cooperman Barnabas Medical Center (FKA Saint Barnabas Medical Center),RWJBarnabas Health
1982720249,Hackensack Meridian Health Mountainside Medical Center,Americas Division
1699777458,Saint Michaels Medical Center,Prime Healthcare Services
1215998323,The University Hospital (FKA UMDNJ University Hospital),
1184601288,Woodbury Hospital (Closed - No Longer Offering Inpatient Hospital Services),Inspira Health Network (FKA South Jersey Healthcare)
1689744856,Jersey City Medical Center,RWJBarnabas Health
1043475668,Hoboken University Medical Center,CarePoint Health
1093736001,Palisades Medical Center,Hackensack Meridian Health
1871859306,Christ Hospital,CarePoint Health
1821101239,Bayonne Medical Center,CarePoint Health
1710491253,Hudson Regional Hospital (FKA Meadowlands Hospital Medical Center),
1922095116,Hunterdon Health (FKA Hunterdon Medical Center),
1689714255,Princeton Medical Center (FKA University Medical Center of Princeton at Plainsboro),Penn Medicine (AKA University of Pennsylvania Health System)
1255419651,St Francis Medical Center (Closed - No Longer Offering Inpatient Services),Capital Health
1073516183,Capital Health Medical Center - Hopewell,Capital Health
1629069638,RWJ University Hospital Hamilton,RWJBarnabas Health
1275583726,Capital Health Regional Medical Center,Capital Health
1659387975,JFK University Medical Center,Hackensack Meridian Health
1114924834,Saint Peters University Hospital,St Peters Healthcare System
1346243375,Robert Wood Johnson University Hospital New Brunswick,RWJBarnabas Health
1770569832,Raritan Bay Medical Center (FKA Raritan Bay Medical Center - Perth Amboy),Hackensack Meridian Health
1346247368,Jersey Shore University Medical Center,Hackensack Meridian Health
1609983790,Monmouth Medical Center,RWJBarnabas Health
1295718450,CentraState Medical Center,Atlantic Health System
1831197508,Bayshore Medical Center (FKA Bayshore Community Hospital),Hackensack Meridian Health
1336147834,Riverview Medical Center,Hackensack Meridian Health
1811994809,Chilton Medical Center,Atlantic Health System
1053384776,Morristown Medical Center,Atlantic Health System
1598144362,Saint Clares Denville Hospital,Saint Clares Health
1962409987,Ocean University Medical Center,Hackensack Meridian Health
1013010917,Community Medical Center,RWJBarnabas Health
1831601590,Southern Ocean Medical Center,Hackensack Meridian Health
1225133473,Monmouth Medical Center Southern Campus,RWJBarnabas Health
1669462420,St Josephs University Medical Center (FKA St Josephs Regional Medical Center),St Josephs Health
1770901761,St Marys General Hospital,Prime Healthcare Services
1598760829,St Josephs Wayne Medical Center (AKA St Josephs Wayne Hospital),St Josephs Health
1700351947,Salem Medical Center (FKA the Memorial Hospital of Salem County),Inspira Health Network (FKA South Jersey Healthcare)
1255396024,Inspira Medical Center Elmer (FKA South Jersey Healthcare - Elmer Hospital),Inspira Health Network (FKA South Jersey Healthcare)
1003236878,RWJ University Hospital Somerset (FKA Somerset Medical Center),RWJBarnabas Health
1790789212,Newton Medical Center,Atlantic Health System
1255334678,Saint Clares Health Center at Sussex (Closed - No Inpatient Services),Saint Clares Health
1770583999,Trinitas Regional Medical Center - Williamson Street Campus (FKA Trinitas Regional Medical Center),RWJBarnabas Health
1861486870,RWJ University Hospital Rahway,RWJBarnabas Health
1740254143,Overlook Medical Center,Atlantic Health System
1760488266,St Lukes Warren Campus (FKA Warren Hospital),St Lukes University Health Network
1518969419,Hackettstown Medical Center,Atlantic Health System
1689747552,University of New Mexico Hospital (AKA UNM Hospital),UNM Health System (FKA University of New Mexico Hospitals)
1306914213,Lovelace Medical Center,Lovelace Health System (FKA Lovelace Sandia Health System)
1215913470,Presbyterian Hospital,Presbyterian Healthcare Services
1982799375,Lovelace Womens Hospital,Lovelace Health System (FKA Lovelace Sandia Health System)
1649373887,Lovelace Westside Hospital,Lovelace Health System (FKA Lovelace Sandia Health System)
1417927021,Heart Hospital of New Mexico at Lovelace Medical Center,Lovelace Health System (FKA Lovelace Sandia Health System)
1972878361,Lovelace Regional Hospital (FKA Roswell Regional Hospital),Lovelace Health System (FKA Lovelace Sandia Health System)
1447221742,Eastern New Mexico Medical Center,Community Health Systems (AKA CHS)
1780677039,Cibola General Hospital,
1841365558,Acoma-Canoncito-Laguna Service Unit (Closed),Albuquerque Area Indian Health Service
1083931109,Miners Colfax Medical Center,
1629053509,Plains Regional Medical Center,Presbyterian Healthcare Services
1700821808,Memorial Medical Center,LifePoint Health (FKA LifePoint Hospitals)
1205882503,MountainView Regional Medical Center,Community Health Systems (AKA CHS)
1437286044,Artesia General Hospital,
1790722346,Carlsbad Medical Center,Community Health Systems (AKA CHS)
1336220839,Gila Regional Medical Center,
1346249968,Guadalupe County Hospital,
1881630036,Nor Lea General Hospital,
1285688697,Covenant Health Hobbs Hospital (FKA Lea Regional Medical Center),Covenant Health (TX)
1558347708,Lincoln County Medical Center,Presbyterian Healthcare Services
1285701623,Los Alamos Medical Center,LifePoint Health (FKA LifePoint Hospitals)
1891075446,Mimbres Memorial Hospital,Quorum Health Corporation
1720084999,RMCHCS Hospital (AKA Rehoboth McKinley Christian Health Care Services),
1497843734,Zuni Comprehensive Health Center,Albuquerque Area Indian Health Service
1225002322,Gallup Indian Medical Center,Navajo Area Indian Health Service
1114960093,Crownpoint Health Care Facility,Navajo Area Indian Health Service
1891886065,Mescalero Service Unit (AKA Mescalero Indian Hospital),Albuquerque Area Indian Health Service
1861450579,Gerald Champion Regional Medical Center,CHRISTUS Health
1962488304,Dr Dan C Trigg Memorial Hospital,Presbyterian Healthcare Services
1154307593,Presbyterian Espanola Hospital,Presbyterian Healthcare Services
1073517058,Roosevelt General Hospital,
1427058510,San Juan Regional Medical Center,San Juan Regional Medical Center System
1780639971,Northern Navajo Medical Center - Shiprock,Navajo Area Indian Health Service
1396716643,Alta Vista Regional Hospital,Quorum Health Corporation
1578587150,CHRISTUS St Vincent Regional Medical Center (AKA CHRISTUS St Vincent Health System),CHRISTUS St Vincent Regional Health System
1285613836,Santa Fe Service Unit (AKA Santa Fe Indian Hospital),Albuquerque Area Indian Health Service
1427112473,CHRISTUS St Vincent Physicians Medical Center,CHRISTUS St Vincent Regional Health System
1760446009,Sierra Vista Hospital,
1790761138,Socorro General Hospital,Presbyterian Healthcare Services
1902338049,Holy Cross Hospital,
1427051002,Union County General Hospital,Community Hospital Corporation (AKA CHC)
1801837539,Samaritan Hospital - Albany Memorial Campus (FKA Albany Memorial Hospital - Closed - No Longer Offering Inpatient Services),St Peters Health Partners
1376577247,Albany Medical Center,Albany MED Health System (FKA Albany Medical Center Health System)
1497701106,St Peters Hospital,St Peters Health Partners
1811917461,Albany Medical Center - South Clinical Campus,Albany MED Health System (FKA Albany Medical Center Health System)
1720030703,Jones Memorial Hospital,University of Rochester Medical Center
1427063270,NYC Health and Hospitals - Lincoln (FKA Lincoln Medical & Mental Health Center),NYC Health and Hospitals (FKA New York City Health and Hospitals Corporation)
1629087580,Our Lady of Lourdes Memorial Hospital (AKA Ascension Lourdes Hospital),Ascension Health
,Tri - County Memorial Hospital (Closed),Brooks - TLC Hospital System (FKA TLC Health Network)
1225083074,Olean General Hospital,Kaleida Health
1093712911,Auburn Community Hospital,
1770573222,UPMC Chautauqua,University of Pittsburgh Medical Center (AKA UPMC)
1215917224,Brooks Memorial Hospital,Brooks - TLC Hospital System (FKA TLC Health Network)
1942236427,Westfield Memorial Hospital,Allegheny Health Network (FKA West Penn Allegheny Health System)
1548315401,Roswell Park Comprehensive Cancer Center (FKA Roswell Park Cancer Institute),
1295731123,St Josephs Hospital,Arnot Health
1083605661,Arnot Ogden Medical Center,Arnot Health
1770593956,UHS Chenango Memorial Hospital,United Health Services
1033270699,Champlain Valley Physicians Hospital,The University of Vermont Health Network (FKA Fletcher Allen Partners)
1528024718,Columbia Memorial Hospital,Albany MED Health System (FKA Albany Medical Center Health System)
1740287531,Guthrie Cortland Medical Center (FKA Cortland Regional Medical Center),Guthrie Clinic (FKA Guthrie Healthcare)
1164473039,Margaretville Hospital (FKA Margaretville Memorial Hospital),HealthAlliance of Hudson Valley
1417940719,UHS Delaware Valley Hospital,United Health Services
1598181091,MidHudson Regional Hospital (FKA St Francis Hospital),Westchester Medical Center Health Network
1124072715,Northern Dutchess Hospital,Nuvance Health
1740233899,Vassar Brothers Medical Center,Nuvance Health
1619186327,Sheehan Memorial Hospital (Closed 2012-01-01),
1639209596,Buffalo General Medical Center (FKA Buffalo General Hospital),Kaleida Health
1790727543,Sisters of Charity Hospital,Catholic Health
1275553521,Bertrand Chaffee Hospital,
1770598104,Kenmore Mercy Hospital,Catholic Health
1154370112,Buffalo VA Medical Center,VA New York/New Jersey VA Health Care Network - VISN 2 (FKA VA Health Care Upstate New York)
1164464921,Mercy Hospital of Buffalo,Catholic Health
1437197985,Erie County Medical Center (AKA ECMC),Great Lakes Health System of Western New York
1083607915,Moses-Ludington Hospital (Closed - No Longer Offers Inpatient Services),The University of Vermont Health Network (FKA Fletcher Allen Partners)
1891785184,Elizabethtown Community Hospital,The University of Vermont Health Network (FKA Fletcher Allen Partners)
1699709576,Adirondack Medical Center - Saranac Lake,Adirondack Health
1114954682,Alice Hyde Medical Center,The University of Vermont Health Network (FKA Fletcher Allen Partners)
1336145168,Nathan Littauer Hospital,
1902800352,United Memorial Medical Center,Rochester Regional Health System
1558321919,Little Falls Hospital,Bassett Healthcare
1003814641,River Hospital,
1598713745,Samaritan Medical Center,
1104234376,Carthage Area Hospital,
1548374549,NewYork-Presbyterian Brooklyn Methodist Hospital (FKA New York Methodist Hospital),NewYork-Presbyterian Healthcare System
1346380870,Brookdale University Hospital Medical Center (FKA Brookdale Hospital Medical Center),One Brooklyn Health System
1619341716,NYU Langone Hospital - Brooklyn (FKA NYU Lutheran Medical Center),NYU Langone Health (FKA NYU Langone Medical Center)
1639179328,University Hospital at Downstate (AKA University Hospital of Brooklyn at SUNY Downstate Medical Center),SUNY Health (FKA SUNY Health Sciences Centers)
1700886322,Wyckoff Heights Medical Center,
1093777492,Maimonides Medical Center,Maimonides Health
1124032982,NYC Health and Hospitals/South Brooklyn Health (AKA Ruth Bader Ginsburg Hospital),NYC Health and Hospitals (FKA New York City Health and Hospitals Corporation)
1477716017,Kingsbrook Jewish Medical Center,One Brooklyn Health System
1043224355,NYC Health and Hospitals - Kings County (FKA Kings County Hospital Center),NYC Health and Hospitals (FKA New York City Health and Hospitals Corporation)
1184809055,University Hospital of Brooklyn at Long Island College Hospital (Closed 2014-05-01),SUNY Health (FKA SUNY Health Sciences Centers)
1326046467,Brooklyn Hospital Center at Downtown Campus,
1215030697,Maimonides Midwood Community Hospital (FKA New York Community Hospital of Brooklyn),Maimonides Health
1467469023,NYC Health and Hospitals - Woodhull (FKA Woodhull Medical and Mental Health Center),NYC Health and Hospitals (FKA New York City Health and Hospitals Corporation)
1487724712,Interfaith Medical Center,One Brooklyn Health System
1619390838,Lewis County General Hospital,
1982625661,UR Medicine Noyes Health (AKA Nicholas H Noyes Memorial Hospital),University of Rochester Medical Center
1992707608,Community Memorial Hospital,Crouse Hospital Health System
1962408203,Oneida Health Hospital,
1255360517,Rochester General Hospital,Rochester Regional Health System
1972548568,Highland Hospital,University of Rochester Medical Center
1346285657,Strong Memorial Hospital,University of Rochester Medical Center
1760421713,Unity Hospital,Rochester Regional Health System
1639136153,Strong Memorial Hospital West (FKA Lakeside Memorial Hospital - Closed Inpatient Care April 2013),University of Rochester Medical Center
1083788939,Monroe Community Hospital,
1386711505,St Marys Hospital - Amsterdam Memorial Campus (Closed - Outpatient Services Only),St Marys Healthcare (NY)
1811977796,St Marys Hospital - Hospital Campus,St Marys Healthcare (NY)
1366459570,North Shore University Hospital,Northwell Health (AKA North Shore Long Island Jewish Health System)
1114925567,NYU Langone Hospital - Long Island (FKA NYU Winthrop Hospital),NYU Langone Health (FKA NYU Langone Medical Center)
1255354221,Long Beach Medical Center (Closed),
1922079094,Mount Sinai South Nassau (FKA South Nassau Communities Hospital),Mount Sinai Health System (FKA Mount Sinai Medical Center)
1285641514,Long Island Jewish Medical Center,Northwell Health (AKA North Shore Long Island Jewish Health System)
1295743060,Glen Cove Hospital,Northwell Health (AKA North Shore Long Island Jewish Health System)
1043279565,St Francis Hospital & Heart Center (AKA St Francis Hospital - The Heart Center),Catholic Health (AKA Catholic Health Services of Long Island)
1083621130,Plainview Hospital,Northwell Health (AKA North Shore Long Island Jewish Health System)
1013998426,St Joseph Hospital,Catholic Health (AKA Catholic Health Services of Long Island)
1659330173,Mercy Hospital (FKA Mercy Medical Center),Catholic Health (AKA Catholic Health Services of Long Island)
1801857172,NuHealth - Nassau University Medical Center,
1346603107,Long Island Jewish Valley Stream (FKA Franklin Hospital),Northwell Health (AKA North Shore Long Island Jewish Health System)
1194889956,North General Hospital (Closed 2011-01-01),
1932103413,The Mount Sinai Hospital (AKA Mount Sinai Medical Center),Mount Sinai Health System (FKA Mount Sinai Medical Center)
1033124961,NYC Health and Hospitals - Harlem (FKA Harlem Hospital Center),NYC Health and Hospitals (FKA New York City Health and Hospitals Corporation)
1952346223,SVCMC - St Vincents Centers NY & West Branches (Closed 2010-04-01),
1598703019,Hospital for Special Surgery,
1083663124,Manhattan VA Medical Center (AKA Margaret Cochran Corbin VA Campus),VA New York/New Jersey VA Health Care Network - VISN 2 (FKA VA Health Care Upstate New York)
1013924372,NYC Health and Hospitals - Metropolitan (FKA Metropolitan Hospital Center),NYC Health and Hospitals (FKA New York City Health and Hospitals Corporation)
1801992631,Tisch Hospital,NYU Langone Health (FKA NYU Langone Medical Center)
1073535027,NYC Health and Hospitals - Bellevue (FKA Bellevue Hospital Center),NYC Health and Hospitals (FKA New York City Health and Hospitals Corporation)
1174689665,Mount Sinai Beth Israel (FKA Beth Israel Medical Center),Mount Sinai Health System (FKA Mount Sinai Medical Center)
1700887411,Memorial Sloan Kettering Cancer Center,
1477616571,Lenox Hill Hospital,Northwell Health (AKA North Shore Long Island Jewish Health System)
1245251222,New York Eye and Ear Infirmary of Mount Sinai,Mount Sinai Health System (FKA Mount Sinai Medical Center)
1811368368,Mount Sinai Morningside (FKA Mount Sinai St Lukes),Mount Sinai Health System (FKA Mount Sinai Medical Center)
1053413989,NewYork-Presbyterian Lower Manhattan Hospital (AKA New York Downtown Hospital),NewYork-Presbyterian Healthcare System
1285717298,Niagara Falls Memorial Medical Center,
1063400539,Eastern Niagara Hospital - Lockport (Closed),Eastern Niagara Health System (Closed)
1043394745,Mount St Marys Hospital,Catholic Health
1376546440,Rome Health (FKA Rome Memorial Hospital),
1821093402,St Elizabeth Campus - Mohawk Valley Health System (AKA St Elizabeth Medical Center),Mohawk Valley Health System
1205877172,St Lukes Campus - Mohawk Valley Health System (AKA Faxton St Lukes Healthcare - St Lukes Campus),Mohawk Valley Health System
1942294053,Upstate Community Hospital (FKA Upstate University Hospital - Community Campus),SUNY Upstate Medical University
1508815333,St Josephs Health Hospital (AKA St Josephs Health),St Peters Health Partners
1578554630,Upstate University Hospital (FKA Upstate University Hospital - Downtown Campus),SUNY Upstate Medical University
1619926086,Syracuse VA Medical Center,VA New York/New Jersey VA Health Care Network - VISN 2 (FKA VA Health Care Upstate New York)
1043331937,Crouse Hospital,Crouse Hospital Health System
1366505463,Clifton Springs Hospital & Clinic,Rochester Regional Health System
1427006758,Canandaigua VA Medical Center,VA New York/New Jersey VA Health Care Network - VISN 2 (FKA VA Health Care Upstate New York)
1194776351,UR Medicine Thompson Health (AKA FF Thompson Hospital),University of Rochester Medical Center
1952418352,Geneva General Hospital,Finger Lakes Health
1659360709,Bon Secours Community Hospital,Bon Secours Charity Health System
1609875772,Garnet Health Medical Center (FKA Orange Regional Medical Center),Garnet Health (FKA Greater Hudson Valley Health System)
1003923434,St Lukes Cornwall Hospital - Newburgh Campus,Montefiore Health System (AKA Montefiore Medical Center - Health System)
1598755324,St Anthony Community Hospital,Bon Secours Charity Health System
1609873520,Orleans Community Health - Medina Memorial Hospital,
1871678458,Oswego Hospital (AKA Oswego Health),
1578529954,Aurelia Osborn Fox Memorial Hospital (AKA AO Fox Hospital),Bassett Healthcare
1780600577,Bassett Medical Center,Bassett Healthcare
1972557379,Putnam Hospital,Nuvance Health
1316954449,Long Island Jewish Forest Hills (FKA Forest Hills Hospital),Northwell Health (AKA North Shore Long Island Jewish Health System)
1154461622,Flushing Hospital Medical Center,MediSys Health Network
1801803903,NYC Health and Hospitals - Queens (FKA Queens Hospital Center),NYC Health and Hospitals (FKA New York City Health and Hospitals Corporation)
1063426377,NYC Health and Hospitals - Elmhurst (FKA Elmhurst Hospital Center),NYC Health and Hospitals (FKA New York City Health and Hospitals Corporation)
1952347205,NewYork-Presbyterian Queens,NewYork-Presbyterian Healthcare System
1245370717,Jamaica Hospital Medical Center,MediSys Health Network
1528258407,Peninsula Hospital Center (Closed 2012-04-01),
1346274537,St Johns Episcopal Hospital (AKA Episcopal Health Services Inc),
1811982911,Samaritan Hospital - St Marys Campus,St Peters Health Partners
1043267727,Samaritan Hospital - Main Campus,St Peters Health Partners
1407877137,Staten Island University Hospital - North Campus,Northwell Health (AKA North Shore Long Island Jewish Health System)
1740389154,Richmond University Medical Center,
1346213469,Good Samaritan Hospital,Bon Secours Charity Health System
1104808062,Montefiore Nyack Hospital (FKA Nyack Hospital),Montefiore Health System (AKA Montefiore Medical Center - Health System)
1063525442,Helen Hayes Hospital,
1629409925,Gouverneur Hospital (FKA Edward John Noble Hospital of Gouverneur),St Lawrence Health System
1568548782,Canton-Potsdam Hospital,St Lawrence Health System
1972604460,Massena Hospital (FKA Massena Memorial Hospital),St Lawrence Health System
1891753034,Claxton-Hepburn Medical Center,
1073569331,Saratoga Hospital,Albany MED Health System (FKA Albany Medical Center Health System)
1487644993,Ellis Hospital,Ellis Medicine
1578664470,Sunnyview Rehabilitation Hospital (FKA Sunnyview Hospital and Rehabilitation Center),St Peters Health Partners
1891862579,Cobleskill Regional Hospital,Bassett Healthcare
1639150477,Schuyler Hospital,Cayuga Health System
1609825702,Bath VA Medical Center,VA New York/New Jersey VA Health Care Network - VISN 2 (FKA VA Health Care Upstate New York)
1306930318,Ira Davenport Memorial Hospital,Arnot Health
1013985399,St James Hospital (FKA St James Mercy Hospital),University of Rochester Medical Center
1346241973,Guthrie Corning Hospital,Guthrie Clinic (FKA Guthrie Healthcare)
1902865355,Good Samaritan University Hospital (FKA Good Samaritan Hospital Medical Center),Catholic Health (AKA Catholic Health Services of Long Island)
1033224704,Stony Brook Southampton Hospital (FKA Southampton Hospital),Stony Brook Medicine (AKA Stony Brook University Hospital System)
1164481529,St Charles Hospital,Catholic Health (AKA Catholic Health Services of Long Island)
1033169412,Northport VA Medical Center,VA New York/New Jersey VA Health Care Network - VISN 2 (FKA VA Health Care Upstate New York)
1093718728,John T Mather Memorial Hospital of Port Jefferson (AKA Mather Hospital),Northwell Health (AKA North Shore Long Island Jewish Health System)
1053354100,Long Island Community Hospital (FKA Brookhaven Memorial Hospital Medical Center),NYU Langone Health (FKA NYU Langone Medical Center)
1386649804,Peconic Bay Medical Center,Northwell Health (AKA North Shore Long Island Jewish Health System)
1881690691,Stony Brook Eastern Long Island Hospital,Stony Brook Medicine (AKA Stony Brook University Hospital System)
1508845322,Huntington Hospital,Northwell Health (AKA North Shore Long Island Jewish Health System)
1457369381,South Shore University Hospital (FKA Southside Hospital),Northwell Health (AKA North Shore Long Island Jewish Health System)
1982663423,St Catherine of Siena Medical Center,Catholic Health (AKA Catholic Health Services of Long Island)
1972523348,Stony Brook University Hospital,Stony Brook Medicine (AKA Stony Brook University Hospital System)
1710977012,Garnet Health Medical Center - Harris Campus (FKA Catskill Regional Medical Center - Harris Campus),Garnet Health (FKA Greater Hudson Valley Health System)
1962422733,Cayuga Medical Center,Cayuga Health System
1932182599,HealthAlliance Hospital Marys Ave Campus (FKA Benedictine Hospital),HealthAlliance of Hudson Valley
1265484489,HealthAlliance Hospital Broadway Campus (FKA Kingston Hospital),HealthAlliance of Hudson Valley
1871606764,Glens Falls Hospital,Albany MED Health System (FKA Albany Medical Center Health System)
1770671182,Newark-Wayne Community Hospital,Rochester Regional Health System
1477640258,Saint Josephs Medical Center,Saint Josephs Medical Center
1295163244,Montefiore New Rochelle Hospital (FKA Sound Shore Medical Center of Westchester),Montefiore Health System (AKA Montefiore Medical Center - Health System)
1578526695,St Johns Riverside Hospital - Andrus Pavilion,St Johns Riverside Health System
1447255153,White Plains Hospital,Montefiore Health System (AKA Montefiore Medical Center - Health System)
1932280666,Westchester Medical Center,Westchester Medical Center Health Network
1881659274,NewYork-Presbyterian Hudson Valley Hospital (FKA Hudson Valley Hospital Center),NewYork-Presbyterian Healthcare System
1720185267,Phelps Hospital,Northwell Health (AKA North Shore Long Island Jewish Health System)
1780196345,NewYork-Presbyterian Westchester (FKA NewYork-Presbyterian Lawrence Hospital),NewYork-Presbyterian Healthcare System
1992131320,Montefiore Mount Vernon Hospital,Montefiore Health System (AKA Montefiore Medical Center - Health System)
1326097700,Franklin Delano Roosevelt Hospital,VA New York/New Jersey VA Health Care Network - VISN 2 (FKA VA Health Care Upstate New York)
1912992215,Northern Westchester Hospital,Northwell Health (AKA North Shore Long Island Jewish Health System)
1841295219,Burke Rehabilitation Hospital,Montefiore Health System (AKA Montefiore Medical Center - Health System)
1316924913,Wyoming County Community Health System (AKA Wyoming County Community Hospital),
1215044516,Soldiers & Sailors Memorial Hospital,Finger Lakes Health
1326010273,Cone Health Alamance Regional Medical Center (AKA Alamance Regional Medical Center),Cone Health (FKA Moses Cone Memorial Health)
1356318968,Alleghany Memorial Hospital (AKA Allegheny Health),Atrium Health Wake Forest Baptist (FKA Wake Forest Baptist Health)
1265407175,Atrium Health Anson (FKA Carolinas HealthCare System Anson),Atrium Health (FKA Carolinas HealthCare System)
1376671370,Ashe Memorial Hospital,
1225088255,Charles A Cannon Jr Memorial Hospital (AKA Cannon Memorial Hospital),Appalachian Regional Healthcare System
1346205978,Vidant Pungo Hospital (FKA Pungo District Hospital - Closed),ECU Health (FKA Vidant Health)
1679867170,ECU Health Beaufort Hospital (FKA Vidant Beaufort Hospital),ECU Health (FKA Vidant Health)
1013999705,ECU Health Bertie Hospital (FKA Vidant Bertie Hospital),ECU Health (FKA Vidant Health)
1558537282,Cape Fear Valley - Bladen County Hospital,Cape Fear Valley Health System (FKA Cumberland County Hospital System)
1710915756,Novant Health Brunswick Medical Center (FKA Brunswick Community Hospital),Novant Health
