NPI Number,Hospital Name,IDN
1700553856,Wolfson Childrens Hospital,Baptist Health (Jacksonville FL)
1679927081,CHRISTUS Spohn Hospital Corpus Christi - Memorial (Closed),CHRISTUS Spohn Health System
1104982917,Mount Sinai West (FKA Roosevelt Hospital Mount Sinai Roosevelt),Mount Sinai Health System (FKA Mount Sinai Medical Center)
1063631786,Fremont Medical Center (Closed),
1134510514,Banner Childrens at Desert (FKA Cardon Childrens Medical Center),Banner Health
1447421193,Lehigh Valley Hospital - 17th Street,Lehigh Valley Health Network
1144592866,Presbyterian Rust Medical Center,Presbyterian Healthcare Services
1780660233,Carilion Roanoke Community Hospital,Carilion Clinic
1760787576,WellSpan Surgery & Rehabilitation Hospital,WellSpan Health
1811237985,Prisma Health Baptist Parkridge Hospital (FKA Palmetto Health Baptist Parkridge),Prisma Health - Midlands (FKA Palmetto Health)
1922378215,Santa Rosa Behavioral Healthcare Hospital (FKA Aurora Santa Rosa Hospital),Northern California Behavioral Health System
1689784225,Parkview Hospital Randallia,Parkview Health
1497021265,Thornton Pavilion (FKA John M and Sally B Thornton Hospital),University of California San Diego Health System (AKA UC San Diego Health)
1417279936,West Kendall Baptist Hospital,Baptist Health South Florida
1679816201,Temecula Valley Hospital,Southwest Healthcare System
1912007931,Mercy Health - West Hospital,Mercy Health (FKA Catholic Health Partners)
1811072341,Kindred Hospital South Florida Hollywood,ScionHealth
1235333089,Kindred Hospital Philadelphia - Havertown,ScionHealth
1184981656,Golisano Childrens Hospital of Southwest Florida,Lee Health (AKA Lee Memorial Health System)
,Clarksburg Community Hospital (Closed - Plans Rejected),Adventist HealthCare (MD)
1679875645,Ochsner Stennis Hospital (AKA John C Stennis Memorial Hospital),Ochsner Rush Health (FKA Rush Health Systems)
1568713410,Lafayette Regional Rehabilitation Hospital,Ernest Health
1174706659,Childrens Hospital at Erlanger (FKA TC Thompson Childrens Hospital at Erlanger),Erlanger Health System
1962693895,Adventist Health Selma,Adventist Health Central Valley Network
1124078704,DSH - Coalinga (FKA Coalinga State Hospital),California Department of State Hospitals (FKA California Department of Mental Health)
,Strategic Behavioral Health (Closed),Strategic Behavioral Health (Closed)
1659524486,Peak View Behavioral Health,Summit BHC
,SUNY Downstate Medical Center System (Closed),SUNY Downstate Medical Center System (Closed)
,Progressive Acute Care (Closed - Absorbed by Allegiance Health Management),Progressive Acute Care (Closed - Absorbed by Allegiance Health Management)
1730396714,The Herman & Walter Samuelson Childrens Hospital at Sinai,LifeBridge Health
1457096265,Warm Springs Rehabilitation Hospital of Thousand Oaks (Closed - Merged with PAM Health Warm Springs Rehabilitation Hospital Northeast San Antonio),PAM Health (FKA Post Acute Medical)
1952348021,Methodist Hospital Specialty and Transplant,HCA San Antonio Division (AKA Methodist Healthcare of San Antonio)
1700801909,Providence Childrens Hospital,The Hospitals of Providence (FKA Sierra Providence Health Network)
1255461935,Hospital Metropolitano De La Montana,Metro Pavia Health System
1073518007,Hoops Family Childrens Hospital,Mountain Health Network
1851511489,CAMC Womens and Childrens Hospital,Charleston Area Medical Center Health System (AKA CAMC Health System)
1386711315,UF Health Psychiatric Hospital (FKA Shands Vista),University of Florida Health (FKA Shands Healthcare)
1063856102,Norwalk Community Hospital,Alta Los Angeles Hospitals (AKA Alta Hospitals System)
1477502029,Naval Medical Center Camp Lejeune,US Navy Medicine
1386604387,Naval Hospital Camp Pendleton,US Navy Medicine
1962468389,Naval Hospital Jacksonville,Defense Health Agency (AKA DHA)
1730134206,Naval Health Clinic Oak Harbor (AKA Naval Hospital Oak Harbor - Closed),US Navy Medicine
1013973494,Naval Hospital Pensacola (Closed - No longer offering inpatient services),US Navy Medicine
1699726570,Naval Hospital Twentynine Palms (AKA Robert E Bush Naval Hospital),US Navy Medicine
1407165053,Walter Reed National Military Medical Center,Defense Health Agency (AKA DHA)
1063904076,Northeast Georgia Medical Center Braselton (AKA NGMC Braselton),Northeast Georgia Health System
1366486094,H John Heinz III Department of Veterans Affairs Medical Center,VA Healthcare - VISN 4 (FKA VA Stars & Stripes Healthcare Network)
1568498459,VA Pittsburgh Healthcare System - Highland Drive Campus (Closed),VA Healthcare - VISN 4 (FKA VA Stars & Stripes Healthcare Network)
1255380697,Naval Medical Center Portsmouth,US Navy Medicine
1619534112,McLeod Health Seacoast (FKA Seacoast Medical Center),McLeod Health
1851349153,Florida Hospital Oceanside (Closed),AdventHealth (FKA Adventist Health System)
1396732871,Naval Medical Center San Diego,US Navy Medicine
1831146281,Tripler Army Medical Center,US Army Medicine
1841390077,Madigan Army Medical Center,US Army Medicine
1295838787,William Beaumont Army Medical Center - Fort Bliss,US Army Medicine
1699877993,Bassett Army Community Hospital,US Army Medicine
1497795702,Evans Army Community Hospital,US Army Medicine
1225083249,General Leonard Wood Army Community Hospital,US Army Medicine
1649218264,Irwin Army Community Hospital,US Army Medicine
1275618514,Weed Army Community Hospital (AKA Army Community Hospital Weed-Irwin),US Army Medicine
1922195510,Brooke Army Medical Center,US Army Medicine
1306219282,Parham Doctors Hospital,HCA Capital Division - HCA Virginia Health System
1801988779,Carl R Darnall Army Medical Center (AKA Army Medical Center Darnall-Hood),US Army Medicine
1578660742,Dwight D Eisenhower Army Medical Center,US Army Medicine
1568879864,Choctaw Regional Medical Center (FKA Pioneer Community Hospital of Choctaw),
1104991215,Bayne-Jones Army Community Hospital,US Army Medicine
1417044702,Blanchfield Army Community Hospital,Defense Health Agency (AKA DHA)
1194730846,Benning Martin Army Community Hospital,US Army Medicine
1386652956,Moncrief Army Community Hospital (Closed - Inpatient Services Discontinued),US Army Medicine
1487752960,Reynolds Army Community Hospital (Closed - no longer provides inpatient services),US Army Medicine
1225081136,Winn Army Community Hospital,US Army Medicine
1740377423,Womack Army Medical Center,Defense Health Agency (AKA DHA)
1528161916,Keller Army Community Hospital,US Army Medicine
1871575837,McDonald Army Health Center (Closed - No Longer Offers Inpatient Services),US Army Medicine
1205896701,60th Medical Group - Travis AFB (AKA David Grant USAF Medical Center),US Air Force Medicine
1588647770,96th Medical Group - Eglin AFB,US Air Force Medicine
1568446524,673d Medical Group - Joint Base Elmendorf-Richardson,US Air Force Medicine
1710967526,81st Medical Group - Keesler AFB,Defense Health Agency (AKA DHA)
1154393759,Mike OCallaghan Military Medical Center - Nellis Air Force Base (FKA 99th Medical Group - Mike Ocallaghan Military Medical Center),US Air Force Medicine
1275568909,88th Medical Group - Wright-Patterson Medical Center,US Air Force Medicine
,LTAC of Louisiana - Abbeville Campus (Closed),AMG Integrated Healthcare Management
1235199084,Shannon Womens & Childrens Hospital,Shannon Health
1972613305,UPMC West Shore (FKA West Shore Hospital),UPMC Central Pennsylvania (FKA Pinnacle Health Hospitals)
1144566316,Baylor Scott & White Emergency Medical Center - Cedar Park (Closed - No Longer Offering Inpatient Services),Baylor Scott & White Health
1194784934,Naval Hospital Beaufort,US Navy Medicine
1427010420,Naval Hospital Bremerton,US Navy Medicine
1285624015,St Johns Riverside Hospital - ParkCare Pavilion,St Johns Riverside Health System
1639150816,MaineGeneral Medical Center - Seton Campus (Closed),MaineGeneral Health
1346295987,MaineGeneral Medical Center - Thayer Campus (Closed - No Inpatient Services),MaineGeneral Health
,North Philadelphia Health System (Closed),North Philadelphia Health System (Closed)
1891756151,6th Medical Group - MacDill Air Force Base (Closed - No Longer Offers Inpatient Services),US Air Force Medicine
,AMITA Health Adventist Midwest Health (Closed - Absorbed by Amita Health),AMITA Health Adventist Midwest Health (Closed - Absorbed by Amita Health)
,Yakima Valley Memorial Hospital System (Closed - Absorbed by Virginia Mason Health System),Yakima Valley Memorial Hospital System (Closed - Absorbed by Virginia Mason Health System)
1689772592,UCSF Medical Center at Mount Zion,University of California San Francisco Health System (AKA UCSF Health)
1164977237,UCSF Benioff Childrens Hospital San Francisco,University of California San Francisco Health System (AKA UCSF Health)
1609345685,Florence Hospital (FKA Florence Hospital at Anthem),Steward Health Care System
1801340781,Peoria Regional Medical Center (Closed),
1235226440,Los Ninos Hospital (Closed),Hacienda HealthCare (Closed - No Longer Offering Hospital Services)
,Pacific Health Corporation (Closed),Pacific Health Corporation (Closed)
1790094985,Cypress Pointe Surgical Hospital,
1306011929,Baylor Institute for Rehabilitation - Northwest Dallas (FKA Globalrehab - Dallas - Closed),Baylor Scott & White Health
,Globalrehab (Closed - Purchased by Baylor Health),Globalrehab (Closed - Purchased by Baylor Health)
1396902540,Baylor Scott & White Institute for Rehabilitation - Fort Worth (FKA Globalrehab - Fort Worth),Baylor Scott & White Health
1568695146,Methodist Hospital Stone Oak Rehabilitation Center (FKA Select Rehabilitation Hospital of San Antonio),HCA San Antonio Division (AKA Methodist Healthcare of San Antonio)
1932407251,Noland Hospital Shelby (Closed),Noland Health Services
1720270697,Beacon Behavioral Hospital (FKA Beacon Childrens Hospital),Perimeter Healthcare
1952550071,Windhaven Psychiatric Hospital,
1790925972,Springwoods Behavioral Health,Universal Health Services
1417199225,Riverview Behavioral Health (FKA Vista Health Texarkana),Acadia Healthcare
1750389672,Daystar (Christian Science Nursing - Closed),
1467697953,AdventHealth Connerton (FKA Florida Hospital at Connerton - Long Term Acute Care),AdventHealth (FKA Adventist Health System)
1437128618,CHRISTUS Spohn Hospital Corpus Christi - South,CHRISTUS Spohn Health System
1023436102,Landmark Hospital of Savannah,Landmark Hospitals
,EASTAR Health System (Closed - Absorbed by Saint Francis Health System),EASTAR Health System (Closed - Absorbed by Saint Francis Health System)
1982878682,Haverhill Pavilion Behavioral Health Hospital (FKA the Whittier Pavilion),Acadia Healthcare
1891966065,Harsha Behavioral Center,
1457594830,Brentwood Springs (FKA Brentwood Meadows),Springstone Inc
1619069275,MISH Hospital and Clinics (AKA Institute for Advanced Bariatric Surgery),
1720217755,Pathway Rehab Hospital of Bossier,
1134394885,Oceans Behavioral Hospital Alexandria,Oceans Healthcare
1720437684,Oceans Behavioral Hospital Crowley (FKA Phoenix Behavioral Hospital - Closed),Oceans Healthcare
,Oceans Behavioral Hospital Greater New Orleans - Kenner,Oceans Healthcare
1972743425,The Samaritan Center,
1649595448,Nebraska Spine Hospital,
1619342136,Willow Crest Hospital,Vizion Health
1346570777,Unity Psychiatric Care - Clarksville (FKA Behavioral Healthcare Center at Clarksville),Unity Psychiatric Care
1871994855,Texas Star Recovery (Closed),Universal Health Services
1114340080,Aspire Hospital (FKA Aspire Behavioral Health of Conroe),
1417120197,ProHealth Rehabilitation Hospital of Wisconsin,ProHealth Care
1215252317,Saint Michaels Hospital (Closed),
1346570710,Baylor Scott & White Orthopedic and Spine Hospital - Arlington,Baylor Scott & White Health
1922398254,Texas Specialty Hospital In Lubbock (Closed),Fundamental Long-Term Care Holdings
1619071313,Life Center Specialty Hospital (Closed 2011-07-01),
1982973442,Baton Rouge Behavioral Hospital (FKA Focus Behavioral Hospital),Oglethorpe Inc
1124355128,Seaside Behavioral Center - New Orleans,Seaside Healthcare
1760661870,Central New York Psychiatric Center,New York State Office of Mental Health
1346307881,New York City Childrens Center - Queens Campus (FKA Queens Childrens Psychiatric Center),New York State Office of Mental Health
,Pioneer Health Services (Closed),Pioneer Health Services (Closed)
1851337141,Tufts Childrens Hospital (FKA Floating Hospital for Children at Tufts Medical Center - Closed - No Longer Offering Inpatient Care Services),Tufts Medical Center Health System (Closed)
,Tufts Medical Center Health System (Closed),Tufts Medical Center Health System (Closed)
1891115861,UMass Memorial Childrens Medical Center,UMass Memorial Health Care
1265735674,Cancer Care Partners (Closed Inpatient Services),
1285930891,Baylor Scott & White Institute for Rehabilitation - Frisco,Baylor Scott & White Health
1114367497,Martin Luther King Jr Community Hospital,
1760835144,Veritas Collaborative - Adult Hospital Durham,Veritas Collaborative
1265505747,Alexander T Augusta Military Medical Center (FKA Fort Belvoir Community Hospital),Defense Health Agency (AKA DHA)
1356501753,Inova L J Murphy Childrens Hospital (AKA Inova Childrens Hospital),Inova (AKA Inova Health System)
1114216850,Mercy Hospital Southwest - Bakersfield,Dignity Health
1083863682,Randall Childrens Hospital at Legacy Emanuel Medical Center,Legacy Health
1073811378,Roseville Medical Center,Kaiser Permanente Northern California
1598740482,Presbyterian Kaseman Hospital,Presbyterian Healthcare Services
1235141326,Sentara Heart Hospital,Sentara Healthcare
1518197243,University Hospitals MacDonald Womens Hospital,University Hospitals Health System
1154375681,University Hospitals Seidman Cancer Center,University Hospitals Health System
1285041004,ProMedica Russell J Ebeid Childrens Hospital (FKA ProMedica Toledo Childrens Hospital),ProMedica Health System
1508315516,Advocate Childrens Hospital - Oak Lawn,Advocate Health Care
1245571660,Advocate Childrens Hospital - Park Ridge,Advocate Health Care
1235215427,Geisinger Janet Weis Childrens Hospital,Geisinger (FKA Geisinger Health System)
1457847162,Richard & Marion Pearsall Heart Hospital,Geisinger (FKA Geisinger Health System)
1033102942,Carilion Childrens Hospital,Carilion Clinic
1184838492,Baylor Scott & White T Boone Pickens Cancer Hospital,Baylor Scott & White Health
1124305065,Baylor Scott & White Medical Center - McKinney,Baylor Scott & White Health
1669778916,Baylor Scott & White - Fort Worth Andrews Womens Hospital,Baylor Scott & White Health
1144212952,Women & Babies Hospital,Penn Medicine Lancaster General Health (FKA Lancaster General Health)
1154587475,Swedish Medical Center - Ballard Campus,Providence Swedish
1871924233,Santa Fe Hospital (Closed - No Longer Offers Inpatient Services),Baylor Scott & White Health
1396138970,Baylor Scott & White Medical Center - Marble Falls,Baylor Scott & White Health
1962497453,Renown Childrens Hospital,Renown Health
1487132114,Beacon Childrens Hospital (FKA Memorial Childrens Hospital of South Bend),Beacon Health System
1083058143,Goryeb Childrens Hospital,Atlantic Health System
,Wheeling Hospital System (Closed - Merged with WVU Medicine),Wheeling Hospital System (Closed - Merged with WVU Medicine)
,Grace Hospital - South Pointe (Closed),Grace Hospital System
1922081405,Grace Hospital - Parma (FKA Grace Hospital - Bedford),Grace Hospital System
,Saint Vincent Hospital (FKA St Vincent Health System - Closed - Absorbed by Allegheny Health Network),Saint Vincent Hospital (FKA St Vincent Health System - Closed - Absorbed by Allegheny Health Network)
1811597701,K Hovnanian Childrens Hospital,Hackensack Meridian Health
1528445053,UNM Carrie Tingley Hospital - Inpatient Rehabilitation,UNM Health System (FKA University of New Mexico Hospitals)
1689747552,UNM Childrens Hospital,UNM Health System (FKA University of New Mexico Hospitals)
1487917233,PeaceHealth Peace Island Medical Center,PeaceHealth
1285263780,HealthPark Medical Center,Lee Health (AKA Lee Memorial Health System)
1346690492,Ascension Saint Alexius Women & Childrens Hospital (FKA AMITA Health Women & Childrens Hospital Hoffman Estates),Ascension Health Illinois
1104045699,Cornerstone Specialty Hospitals Bellaire (Closed 2020-04-25),Cornerstone Healthcare Group
,Oceans Behavioral Hospital Greater New Orleans - Westbank (Closed),Oceans Healthcare
1760453328,Westwood Lodge Hospital (Closed 2017-08-25),Arbour Health System (Closed)
1023092053,Childrens Hospital at Dartmouth-Hitchcock,Dartmouth Health (FKA Dartmouth-Hitchcock Health)
1710011341,The Unterberg Childrens Hospital at Monmouth Medical Center,RWJBarnabas Health
1720383565,Childrens Hospital of New Jersey at Newark Beth Israel Medical Center,RWJBarnabas Health
1023200037,Novant Health Betty H Cameron Womens & Childrens Hospital (FKA Betty H Cameron Womens and Childrens Hospital),New Hanover Regional Medical Center Health System (AKA New Hanover Health Network)
1821029463,Golisano Childrens Hospital,University of Rochester Medical Center
1659376317,Specialty Hospital of Central Jersey (FKA Specialty Hospital at Kimball),AcuteCare Health System
1053474734,Spectrum Health Lakeland Niles Hospital,Corewell Health South (FKA Spectrum Health Lakeland)
1740436146,The Childrens Hospital at Saint Francis,Saint Francis Health System
1669628061,The Heart Hospital at Saint Francis,Saint Francis Health System
1386733681,Sinai Childrens Hospital,Sinai Health System
1154481729,UF Health Shands Cancer Hospital (FKA Shands Cancer Hospital at University of Florida),University of Florida Health (FKA Shands Healthcare)
1932538089,UF Health Shands Childrens Hospital (FKA Shands Hospital for Children at the University of Florida),University of Florida Health (FKA Shands Healthcare)
1164750840,CHRISTUS Central Louisiana Surgical Hospital (FKA Central Louisiana Surgical Hospital),CHRISTUS Health
1134320955,Atrium Health Behavioral Health - Charlotte (FKA Carolinas HealthCare System Behavioral Health - Charlotte),Atrium Health (FKA Carolinas HealthCare System)
1225361181,Diley Ridge Medical Center,Mount Carmel Health System
1962758375,Orthopaedic and Spine Specialists Orthopaedic Hospital,
1265664544,Physicians Care Surgical Hospital,ValueHealth (FKA NueHealth)
1235510090,Baylor Scott & White Surgical Hospital at Sherman (FKA Heritage Park Surgical Hospital),Baylor Scott & White Health
1023338142,Methodist Hospital for Surgery,Methodist Health System
1952538431,Methodist McKinney Hospital,Methodist Health System
1013968726,Nexus Childrens Hospital - Houston (FKA Healthbridge Childrens Hospital - West Houston),Nexus Health Systems
,Reliant Hospital Partners (Closed - Merged with HealthSouth),Reliant Hospital Partners (Closed - Merged with HealthSouth)
1477731156,Encompass Health Rehabilitation Hospital Vision Park (FKA Reliant Hospital North Houston),Encompass Health Corporation (FKA HealthSouth)
1982920773,Encompass Health Rehabilitation Hospital of Dallas (FKA HealthSouth Rehabilitation Hospital of Dallas),Encompass Health Corporation (FKA HealthSouth)
1427374222,Encompass Health Rehabilitation Hospital of the Mid-Cities (FKA HealthSouth Rehabilitation Hospital of the Mid-Cities),Encompass Health Corporation (FKA HealthSouth)
1548546088,Encompass Health Rehabilitation Hospital of Austin (FKA HealthSouth Rehabilitation Hospital of South Austin),Encompass Health Corporation (FKA HealthSouth)
1376829812,Encompass Health Rehabilitation Hospital the Vintage (FKA HealthSouth Rehabilitation Hospital of Vintage Park),Encompass Health Corporation (FKA HealthSouth)
1023207750,Lindner Center of HOPE,UC Health (AKA University of Cincinnati Health)
1174768071,Mount Sinai Brooklyn (AKA Mount Sinai Beth Israel Brooklyn Medical Center - Kings Highway Division Brooklyn),Mount Sinai Health System (FKA Mount Sinai Medical Center)
1285200105,MUSC Health Columbia Medical Center Northeast (FKA Providence Health Northeast),Medical University of South Carolina Health System (AKA MUSC Health)
1134297393,Jefferson Methodist Hospital,Jefferson Health
,Raritan Bay Medical Center System (Closed - Now Part of Meridian Health),Raritan Bay Medical Center System (Closed - Now Part of Meridian Health)
1356828172,Old Bridge Medical Center (FKA Raritan Bay Medical Center - Old Bridge),Hackensack Meridian Health
1316915903,University of Iowa Stead Family Childrens Hospital,University of Iowa Health Care
1265911010,Bethesda Heart Hospital,Bethesda Health
1902053655,Centegra South Street (Closed - No Longer Offers Inpatient Services),Centegra Health System (Closed - Absorbed by Northwestern Medicine)
1639455868,Franciscan Health Carmel (FKA Franciscan St Francis Health - Carmel),Franciscan Health (FKA Franciscan Alliance St Francis Health Services)
1104063619,Peyton Manning Childrens Hospital at Ascension St Vincent Evansville (FKA St Marys Hospital for Women & Children),St Vincent Health
1871123778,Wiser Hospital for Women and Infants,University of Mississippi Healthcare
1235368663,Childrens of Mississippi (FKA Batson Childrens Hospital),University of Mississippi Healthcare
1336320795,Wallace R Conerly Critical Care Hospital,University of Mississippi Healthcare
1124766514,Covenant Womens Hospital (Closed),Covenant Health (TX)
1174770770,Navicent Health Childrens Hospital (AKA Beverly Knight Olson Childrens Hospital Navicent Health),Atrium Health Navicent (FKA Navicent Health)
1205176765,Bernard & Millie Duker Childrens Hospital at Albany Medical Center,Albany MED Health System (FKA Albany Medical Center Health System)
1689913451,Landmark Hospital of Salt Lake City (Closed),Landmark Hospitals
1598108854,CHRISTUS Southeast Texas St Mary (Closed),CHRISTUS Southeast Texas
1083059539,Vibra Hospital of Springfield (Closed),Vibra Healthcare
1699192203,Vibra Hospital of Western Massachusetts - Central Campus (FKA Kindred Hospital Park View Central Massachusetts),Vibra Healthcare
1902022106,Saint Marys Hospital for Children,
1073704730,UNC Childrens Hospital,UNC Health (FKA UNC Health Care)
1386090611,NC Womens Hospital at UNC Medical Center,UNC Health (FKA UNC Health Care)
1932208576,North Carolina Basnight Cancer Hospital (FKA NC Cancer Hospital),UNC Health (FKA UNC Health Care)
1942509450,NC Neurosciences Hospital at UNC Medical Center,UNC Health (FKA UNC Health Care)
1215003348,Physicians Regional Medical Center - Collier Boulevard,Physicians Regional Healthcare System
1336252717,INTEGRIS Jim Thorpe Rehabilitation,INTEGRIS Health
1861687907,Bryan West Campus,Bryan Health
1275690216,Wise Health System - West Campus (Closed - No Longer Offering Hospital Services),Wise Health System
1861576332,UVA Childrens Hospital,UVA Health System (AKA University of Virginia Health System)
1578793113,UVA Transitional Care Hospital,UVA Health System (AKA University of Virginia Health System)
1255462651,Saint Lukes North Hospital - Smithville,Saint Lukes Health System (Kansas City MO)
1043625692,NewYork-Presbyterian Allen Hospital,NewYork-Presbyterian Healthcare System
1558666990,AdventHealth Pepin Heart Institute (FKA Florida Hospital Pepin Heart Institute),AdventHealth (FKA Adventist Health System)
1073893020,AdventHealth Wesley Chapel (FKA Florida Hospital Wesley Chapel),AdventHealth (FKA Adventist Health System)
1508810573,Corpus Christi Medical Center - Bay Area,HCA Gulf Coast Division - HCA Healthcare Corpus Christi Medical Center
1679891998,Corpus Christi Medical Center - The Heart Hospital,HCA Gulf Coast Division - HCA Healthcare Corpus Christi Medical Center
1346458007,Heart & Vascular Hospital at Hackensack University Medical Center,Hackensack Meridian Health
1487192241,The Bristol-Myers Squibb Childrens Hospital at RWJUH,RWJBarnabas Health
1669752234,Baptist Neighborhood Hospital - Thousand Oaks,Baptist Health System - San Antonio TX
1851602742,The Sanctuary at the Woodlands,USA Healthcare
1154560290,Allegiance Specialty Hospital of Greenville,Allegiance Health Management
1720480627,Childrens Medical Center Plano,Childrens Health (FKA Childrens Medical Center Dallas)
1649556200,UNM Sandoval Regional Medical Center,UNM Health System (FKA University of New Mexico Hospitals)
1144336512,St Francis Hospital (AKA St Francis Medical Center),Centura Health
1417145210,Chippenham Hospital,HCA Capital Division - HCA Virginia Health System
1831324177,UPMC Passavant - Cranberry,University of Pittsburgh Medical Center (AKA UPMC)
1255317822,UPMC Jameson - South Campus (Closed),University of Pittsburgh Medical Center (AKA UPMC)
1972689172,University Hospitals Lake West Medical Center (FKA West Medical Center),Lake Health
1437175734,VCU Medical Center Critical Care Hospital,VCU Health
,Behavioral Centers of America - Permian Basin (Closed 2012-12-01),
1003859380,Center for Forensic Psychiatry,Michigan Department of Health & Human Services
1659688331,Texas Rehabilitation Hospital of Fort Worth,Texas Health Resources
1154803773,Hoag Hospital Irvine,Hoag Health System
1225301823,Unity Psychiatric Care - Huntsville (FKA Behavioral Healthcare Center at Huntsville),Unity Psychiatric Care
1265601561,Monrovia Memorial Hospital,
1346244969,Wide Horizon,
1114174281,Dr Solomon Carter Fuller Mental Health Center,Massachusetts Bureau of Public Health Facilities
1063746790,Beacon Haven,
1144498643,Seven Hills Behavioral Health Hospital,Acadia Healthcare
1285100792,Kedren Health,
1770740359,Select Rehabilitation Hospital of Denton,Select Medical Corporation
1073651733,Dorothea Dix Hospital (Closed),
1861710238,Carrus Rehabilitation Hospital,Carrus Hospitals
1215051404,Caribbean Medical Center,
1346805520,Perimeter Behavioral Hospital of Arlington,Perimeter Healthcare
1265947113,Inspira Behavioral Care (Closed),
1891000923,Unity Psychiatric Care - Columbia (FKA Behavioral Healthcare Center at Columbia),Unity Psychiatric Care
1083903744,St Bernard Parish Hospital,Ochsner Health System
1538338793,Los Angeles Jewish Home - Grancell Village (FKA Joyce Eisenberg Keefer Medical Center),
1962583039,Community Behavioral Health Hospital - Fergus Falls,Minnesota Department of Human Services
