NPI Number,Hospital Name,IDN
1013281096,Carl T Hayden VA Medical Center,VA Desert Pacific Healthcare Network (VISN 22)
1568412880,Tucson VA Medical Center,VA Desert Pacific Healthcare Network (VISN 22)
1508815291,Fresno VA Medical Center,VA Sierra Pacific Network (VISN 21)
1245289610,West Haven VA Medical Center,VA New England Healthcare System (VISN 1)
1407805898,Wilmington VA Medical Center,VA Healthcare - VISN 4 (FKA VA Stars & Stripes Healthcare Network)
1336198704,Washington DC VA Medical Center,VA Capitol Health Care Network (VISN 5)
1063462000,Malcom Randall Department of Veterans Affairs Medical Center,VA Sunshine Healthcare Network (VISN 8)
1861441867,Boise VA Medical Center,VA Northwest Health Network (VISN 20)
1346537412,Overton Brooks VA Medical Center,VA South Central VA Health Care Network (VISN 16)
1396792032,Merit Health River Oaks (FKA River Oaks Hospital - Jackson),Merit Health
1447201983,Harry S Truman Memorial Veterans Hospital,VA Heartland Network (VISN 15)
1013966118,Raymond G Murphy Department of Veterans Affairs Medical Center,VA Desert Pacific Healthcare Network (VISN 22)
1972945947,Albany Stratton VA Medical Center (AKA Samuel S Stratton Department of Veterans Affairs Medical Center),VA New York/New Jersey VA Health Care Network - VISN 2 (FKA VA Health Care Upstate New York)
1316996630,James J Peters VA Medical Center,VA New York/New Jersey VA Health Care Network - VISN 2 (FKA VA Health Care Upstate New York)
1437100971,Fargo VA Medical Center,VA Midwest Health Care Network (VISN 23)
1174572549,Roseburg VA Medical Center,VA Northwest Health Network (VISN 20)
1730335613,Pittsburgh VA Medical Center - University Drive,VA Healthcare - VISN 4 (FKA VA Stars & Stripes Healthcare Network)
1942391230,Prattville Baptist Hospital,Baptist Health (AL)
1447303227,Thomas Hospital,Infirmary Health System
1134164924,North Baldwin Infirmary,Infirmary Health System
1730692641,Medical Center Barbour,Alliant Management Services
1255376828,Bibb Medical Center,
1184967523,St Vincents Blount,Ascension St Vincents Health System
1992812382,Bullock County Hospital,
1477562783,Georgiana Medical Center (Closed),Ivy Creek Healthcare
1780655332,Regional Medical Center of Central Alabama (FKA LV Stabler Memorial Hospital),UAB Medicine (AKA UAB Health System)
1265483267,Regional Medical Center - Jacksonville (Closed),Northeast Alabama Regional Medical Center Health System (AKA RMC)
1215976675,Stringfellow Memorial Hospital (AKA Stringfellow Campus of Northeast Alabama Regional Medical Center),Northeast Alabama Regional Medical Center Health System (AKA RMC)
1003996000,RMC Anniston (FKA Northeast Alabama Regional Medical Center - Anniston),Northeast Alabama Regional Medical Center Health System (AKA RMC)
1780235002,East Alabama Medical Center - Lanier,East Alabama Health (FKA East Alabama Medical Center Health System)
1962999664,Atrium Health Floyd Cherokee Medical Center,Atrium Health Floyd (FKA Floyd Healthcare Management Inc)
1659387082,Chilton Medical Center (Closed 2012-10-01),
1336139401,Southwest Alabama Medical Center (Closed),
1386694487,Grove Hill Memorial Hospital,
1952427874,Jackson Medical Center,Gilliard Health Services
1477551554,Clay County Hospital,
1114904968,Elba General Hospital (Closed 2013-02-01),
1720039712,Medical Center Enterprise,Community Health Systems (AKA CHS)
1699096552,North Alabama Shoals Hospital (FKA Shoals Hospital),LifePoint Health (FKA LifePoint Hospitals)
1891770368,Evergreen Medical Center,Gilliard Health Services
1821078494,Andalusia Regional Hospital (AKA Andalusia Health),ScionHealth
1013937705,Mizell Memorial Hospital,Alliant Management Services
1235214768,Florala Memorial Hospital (Closed 2013-12-01),
1750480406,Crenshaw Community Hospital,Alliant Management Services
1114919339,Cullman Regional Medical Center,
1942380357,Dale Medical Center,
1871655993,Vaughan Regional Medical Center,ScionHealth
1710901178,Dekalb Regional Medical Center,Quorum Health Corporation
1730120726,Community Hospital,
1588795942,Elmore Community Hospital,Ivy Creek Healthcare
1609811538,DW McMillan Memorial Hospital,
1124073879,Atmore Community Hospital,
1225081516,Gadsden Regional Medical Center,Community Health Systems (AKA CHS)
1992103857,Riverview Regional Medical Center,Prime Healthcare Services
1851323836,Fayette Medical Center (FKA Weimer Medical Center),DCH Health System
1316015241,Russellville Hospital,
1073601043,Red Bay Hospital,Helen Keller Hospital Health System (FKA Northwest Alabama Health Care Authority)
1992755292,Wiregrass Medical Center,
1588779920,Greene County Hospital,
1225068935,Hale County Hospital,
1801830500,Flowers Hospital,Community Health Systems (AKA CHS)
1164403861,Southeast Health Medical Center (FKA Southeast Alabama Medical Center),
1659473916,Highlands Medical Center,Huntsville Hospital Health System
1841298999,Ascension St Vincents Birmingham,Ascension St Vincents Health System
1144312430,Princeton Baptist Medical Center,Brookwood Baptist Health (FKA Baptist Health System Birmingham AL)
1023061405,Grandview Medical Center (FKA Trinity Medical Center),Community Health Systems (AKA CHS)
1841308020,St Vincents East (FKA Medical Center East),Ascension St Vincents Health System
1578809430,UAB Callahan Eye Hospital,UAB Medicine (AKA UAB Health System)
1508952235,Helen Keller Hospital,Helen Keller Hospital Health System (FKA Northwest Alabama Health Care Authority)
1740652346,UAB Hospital,UAB Medicine (AKA UAB Health System)
1790896710,Medical West Hospital,UAB Medicine (AKA UAB Health System)
1043269046,Birmingham VA Medical Center,VA Southeast Network (VISN 7)
1467469502,Cooper Green Mercy Hospital (Closed 2013-01-01 - Now Outpatient Clinic),
1659313906,Brookwood Baptist Medical Center (FKA Brookwood Medical Center),Brookwood Baptist Health (FKA Baptist Health System Birmingham AL)
1508805581,UAB Hospital-Highlands,UAB Medicine (AKA UAB Health System)
1477874337,North Alabama Medical Center (FKA Eliza Coffee Memorial Hospital),LifePoint Health (FKA LifePoint Hospitals)
1568453389,Lawrence Medical Center,Huntsville Hospital Health System
1154386431,East Alabama Medical Center - Opelika,East Alabama Health (FKA East Alabama Medical Center Health System)
1144695081,Athens-Limestone Hospital,Huntsville Hospital Health System
1447221056,Huntsville Hospital,Huntsville Hospital Health System
1023061496,Crestwood Medical Center,Community Health Systems (AKA CHS)
1588690085,Whitfield Regional Hospital (FKA Bryan W Whitfield Memorial Hospital),UAB Medicine (AKA UAB Health System)
1750495941,Northwest Regional Health (FKA Northwest Medical Center),UAB Medicine (AKA UAB Health System)
1932160082,North Mississippi Medical Center - Hamilton,North Mississippi Health Services
1508934217,Marshall Medical Center North,Marshall Medical Centers
1306914882,Marshall Medical Center South,Marshall Medical Centers
1154435824,USA Health University Hospital (FKA University of South Alabama Medical Center),USA Health (AKA University of South Alabama Health System)
1952390643,Providence Hospital,USA Health (AKA University of South Alabama Health System)
1558364802,Mobile Infirmary,Infirmary Health System
1003814971,Springhill Medical Center,
1023055191,USA Childrens & Womens Hospital,USA Health (AKA University of South Alabama Health System)
1437160157,Infirmary West (Closed 2012-10-01),Infirmary Health System
1457392904,Monroe County Hospital,
1104917780,Baptist Medical Center East,Baptist Health (AL)
1174573547,Central Alabama VA Medical Center - Montgomery (FKA Central Alabama VA Medical Center - West Campus),VA Southeast Network (VISN 7)
1700977105,Baptist Medical Center South,Baptist Health (AL)
1043262488,Jackson Hospital,
1851362073,Hartselle Medical Center (Closed 2012-01-31),LifePoint Health (FKA LifePoint Hospitals)
1356692297,Decatur Morgan Hospital - Decatur Campus (FKA Decatur General Hospital),Huntsville Hospital Health System
1285904276,Decatur Morgan Hospital - Parkway Campus,Huntsville Hospital Health System
1720331481,Pickens County Medical Center (Closed),
1770814626,Troy Regional Medical Center,
1275591992,Randolph Medical Center (Closed 2011-03-01),
1306885728,Wedowee Hospital (Closed),
1023050101,Jack Hughston Memorial Hospital,
1992809305,St Vincents St Clair,Ascension St Vincents Health System
1053403220,Shelby Baptist Medical Center,Brookwood Baptist Health (FKA Baptist Health System Birmingham AL)
1891801718,Hill Hospital of Sumter County,
1972527265,Coosa Valley Medical Center,
1629166194,Citizens Baptist Medical Center,Brookwood Baptist Health (FKA Baptist Health System Birmingham AL)
1598783904,Lake Martin Community Hospital,Ivy Creek Healthcare
1811913460,Russell Medical Center,UAB Medicine (AKA UAB Health System)
1841394418,DCH Regional Medical Center,DCH Health System
1801846126,Tuscaloosa VA Medical Center,VA Southeast Network (VISN 7)
1760586325,Northport Medical Center,DCH Health System
1497843940,Walker Baptist Medical Center,Brookwood Baptist Health (FKA Baptist Health System Birmingham AL)
1487699203,Washington County Hospital,
1477520526,J Paul Jones Hospital,UAB Medicine (AKA UAB Health System)
1275600967,Lakeland Community Hospital,
1053363119,Providence Alaska Medical Center,Providence Health & Services - Alaska
1952348047,Alaska Regional Hospital,HCA Mountain Division
1437368891,Alaska Native Medical Center,Alaska Area Native Health Service
1063567691,Yukon-Kuskokwim Delta Regional Hospital,Alaska Area Native Health Service
1184674509,Maine VA Medical Center (AKA Togus VA Medical Center),VA New England Healthcare System (VISN 1)
1720537178,Fairbanks Memorial Hospital,Foundation Health Partners
1891849261,Bartlett Regional Hospital,
1528062429,Central Peninsula Hospital,
1396858155,Providence Seward Medical & Care Center,Providence Health & Services - Alaska
1093968372,South Peninsula Hospital,
1396705539,PeaceHealth Ketchikan Medical Center,PeaceHealth
1083663157,Baltimore VA Medical Center,VA Capitol Health Care Network (VISN 5)
1013905660,Providence Kodiak Island Medical Center,Providence Health & Services - Alaska
1417975061,Mat-Su Regional Medical Center,Community Health Systems (AKA CHS)
1225101041,Norton Sound Regional Hospital,Alaska Area Native Health Service
1770581084,Sitka Community Hospital (Closed),
1720062524,Mt Edgecumbe Hospital,Southeast Alaska Regional Health Consortium (AKA SEARHC)
1700364627,Wrangell Medical Center,Southeast Alaska Regional Health Consortium (AKA SEARHC)
1780634162,Edward P Boland Department of Veterans Affairs Medical Center (FKA Northampton VA Medical Center),VA New England Healthcare System (VISN 1)
1568412617,Edith Nourse Rogers Memorial Veterans Hospital,VA New England Healthcare System (VISN 1)
1477876639,Tsehootsooi Medical Center (AKA Fort Defiance Indian Hospital),
1508800129,Chinle Comprehensive Health Care Facility,Navajo Area Indian Health Service
1477735777,Sage Memorial Hospital,
1699766592,White Mountain Regional Medical Center,
1518968767,Copper Queen Community Hospital,
1336118322,Benson Health,
1013060367,Northern Cochise Community Hospital,
1427228212,Cochise Regional Hospital (FKA Southeast Arizona Medical Center - Closed),
1194766543,Canyon Vista Medical Center (FKA Sierra Vista Regional Health Center),LifePoint Health (FKA LifePoint Hospitals)
1780635078,Flagstaff Medical Center,Northern Arizona Healthcare
1578515789,Page Hospital,Banner Health
1548294424,Tuba City Regional Health Care,
1265813075,San Carlos Apache Healthcare (FKA PHS Indian Hospital - San Carlos),
1871566521,Cobre Valley Regional Medical Center,
1063893121,Banner Payson Medical Center (AKA Payson Regional Medical Center),Banner Health
1275588345,Mt Graham Regional Medical Center,
1629028295,La Paz Regional Hospital,
1720011810,Banner Desert Medical Center,Banner Health
1952560914,Banner Boswell Medical Center,Banner Health
1982733655,St Josephs Hospital and Medical Center,Dignity Health
1477537363,Abrazo Central Campus (FKA Phoenix Baptist Hospital),Abrazo Health
1700910189,Chandler Regional Medical Center,Dignity Health
1427009026,St Lukes Medical Center (Closed),Steward Health Care System
1811951429,HonorHealth Scottsdale Osborn Medical Center,HonorHealth (FKA Scottsdale Lincoln Health Network)
1073576740,Valleywise Health Medical Center (FKA Maricopa Medical Center),Valleywise Health (FKA Maricopa Integrated Health System)
1770690695,HonorHealth John C Lincoln Medical Center (FKA John C Lincoln North Mountain Hospital),HonorHealth (FKA Scottsdale Lincoln Health Network)
1992789200,Valleywise Behavioral Health Center - Maryvale (FKA MIHS Maryvale Hospital),Valleywise Health (FKA Maricopa Integrated Health System)
1841224870,Banner - University Medical Center Phoenix (FKA Banner Good Samaritan Medical Center),Banner Health
1437109832,Phoenix Indian Medical Center,Phoenix Area Indian Health Service
1326022732,Abrazo Scottsdale Campus (FKA Paradise Valley Hospital),Abrazo Health
1386608859,HonorHealth Scottsdale Shea Medical Center,HonorHealth (FKA Scottsdale Lincoln Health Network)
1194758284,Banner Baywood Medical Center,Banner Health
1154355188,Banner Thunderbird Medical Center,Banner Health
1528169125,HonorHealth Deer Valley Medical Center,HonorHealth (FKA Scottsdale Lincoln Health Network)
1588823553,Banner Del E Webb Medical Center,Banner Health
1326022765,Abrazo Arrowhead Campus (FKA Arrowhead Hospital),Abrazo Health
1598749269,Abrazo Arizona Heart Hospital,Abrazo Health
1154392231,Mayo Clinic Hospital - Arizona,Mayo Clinic
1215961248,Banner Heart Hospital,Banner Health
1396745832,Arizona Spine & Joint Hospital,Surgery Partners (FKA Symbion Healthcare)
1902881295,CORE Institute Specialty Hospital (FKA the Surgical Hospital of Phoenix),
1093791170,Abrazo West Campus (FKA West Valley Hospital),Abrazo Health
1841282852,Wickenburg Community Hospital,
1124163530,Dignity Health Arizona Specialty Hospital (FKA Arizona Orthopedic Surgical Hospital),Dignity Health
1275566200,Banner Estrella Medical Center,Banner Health
1992735088,Mercy Gilbert Medical Center,Dignity Health
1770596934,Gilbert Hospital (Closed 2018-06-15),New Vision Health (Closed)
1235212721,Mountain Vista Medical Center,Steward Health Care System
1699884858,Banner Gateway Medical Center,Banner Health
1417152745,HonorHealth Scottsdale Thompson Peak Medical Center,HonorHealth (FKA Scottsdale Lincoln Health Network)
1669639639,Arizona Regional Medical Center - Mesa (Closed 2013-04-01),
1760480503,Phoenix Childrens Hospital,Phoenix Childrens Health System
1962637710,Hualapai Mountain Medical Center (Closed 2011-09-30),
1811086994,Valley View Medical Center,LifePoint Health (FKA LifePoint Hospitals)
1255302766,Western Arizona Regional Medical Center,Community Health Systems (AKA CHS)
1780761866,Havasu Regional Medical Center,LifePoint Health (FKA LifePoint Hospitals)
1265423917,Kingman Regional Medical Center,Kingman Regional Medical Center (AKA KRMC)
1144209271,Summit Healthcare Regional Medical Center,
1356628028,Hopi Health Care Center,Phoenix Area Indian Health Service
1427335140,Whiteriver Indian Hospital,Phoenix Area Indian Health Service
1477653889,Little Colorado Medical Center,
1386697688,Oro Valley Hospital,Northwest Healthcare
1326220666,Sells Indian Hospital,Indian Health Service
1487607784,Northwest Medical Center,Northwest Healthcare
1558759498,Banner - University Medical Center South (FKA University of Arizona Medical Center - South Campus),Banner Health
1770563017,Carondelet Heart & Vascular Institute (FKA Tucson Heart Hospital),Carondelet Health Network (AZ)
1265820179,Banner - University Medical Center Tucson (FKA University of Arizona Medical Center),Banner Health
1174512792,Tucson Medical Center (AKA TMC HealthCare),
1265818488,St Marys Hospital,Carondelet Health Network (AZ)
1538535158,St Joseph Hospital,Carondelet Health Network (AZ)
1003232976,Banner Casa Grande Medical Center,Banner Health
1639555865,Holy Cross Hospital,Carondelet Health Network (AZ)
1871534487,Yavapai Regional Medical Center - East,Dignity Health
1275583684,Bob Stump VA Medical Center,VA Desert Pacific Healthcare Network (VISN 22)
1902897820,Yavapai Regional Medical Center - West,Dignity Health
1346291648,Verde Valley Medical Center,Northern Arizona Healthcare
1194706655,Yuma Regional Medical Center,
1790773158,Baptist Health Medical Center - Stuttgart,Baptist Health (AR)
1972586238,DeWitt Hospital & Nursing Home,
1952308215,Ashley County Medical Center,
1881788933,Baxter Health (FKA Baxter Regional Medical Center),
1902051816,Siloam Springs Regional Hospital,Northwest Health System
1316902414,Mercy Hospital Northwest Arkansas (FKA Mercy Medical Center),Mercy (MO)
1568643005,Ozarks Community Hospital of Gravette (AKA Ozarks Community Health System),
1275523912,North Arkansas Regional Medical Center,
1194741611,Bradley County Medical Center,
1457306326,Mercy Hospital Berryville (FKA St Johns Hospital Berryville),Mercy (MO)
1235453192,Chicot Memorial Medical Center,
1174553796,Baptist Health Medical Center-Arkadelphia,Baptist Health (AR)
1891781837,Piggott Health System (FKA Piggott Community Hospital),
1609804822,Baptist Health Medical Center - Heber Springs,Baptist Health (AR)
1346248317,Magnolia Regional Medical Center,
1306896733,Providence VA Medical Center,VA New England Healthcare System (VISN 1)
1891778049,CHI St Vincent Morrilton,CHI St Vincent (FKA St Vincent Health System)
1386699353,NEA Baptist Memorial Hospital,Baptist Memorial Health Care Corporation
1922043686,St Bernards Medical Center,St Bernards Healthcare
1174587125,Baptist Health - Van Buren (FKA Sparks Medical Center - Van Buren),Baptist Health (AR)
1235169822,Crittenden Regional Hospital (Closed 2014-09-01),Baptist Memorial Health Care Corporation
1962410183,CrossRidge Community Hospital,St Bernards Healthcare
1306826029,Dallas County Medical Center,
1770802217,McGehee Hospital (AKA McGehee-Desha County Hospital),
1295767689,Delta Memorial Hospital,
1023363348,Drew Memorial Health System (FKA Drew Memorial Hospital),
1497770424,Conway Regional Medical Center,Conway Regional Health System
1275504128,Mercy Hospital Ozark,Mercy (MO)
1124021811,Levi Hospital (AKA Leo N Levi National Arthritis Hospital),
1609845346,Healthpark Hospital (Closed - Now Called Mercy Outpatient Surgery Center - Higdon Ferry),
1841241833,National Park Medical Center,LifePoint Health (FKA LifePoint Hospitals)
1689628232,CHI St Vincent Hot Springs (FKA Mercy Hospital Hot Springs),CHI St Vincent (FKA St Vincent Health System)
1437222312,Arkansas Methodist Medical Center,
1922353754,Wadley Regional Medical Center at Hope (FKA Medical Park Hospital),Steward Health Care System
1902868391,Baptist Health Medical Center - Hot Spring County (FKA Hot Spring County Medical Center),Baptist Health (AR)
1659320620,Ralph H Johnson VA Medical Center,VA Southeast Network (VISN 7)
1851484695,Howard Memorial Hospital,
1710943881,White River Medical Center,White River Health System
1619365079,Unity Health - Newport (FKA Unity Health - Harris Medical Center),Unity Health
1710931985,Jefferson Regional Medical Center,
1134116049,Johnson Regional Medical Center,
1194724658,Lawrence Memorial Hospital,
1760453633,Mercy Hospital Paris (FKA North Logan Mercy Hospital),Mercy (MO)
1992133714,Mercy Hospital Booneville (FKA Booneville Community Hospital),Mercy (MO)
1366685992,South Mississippi County Regional Medical Center,Mississippi County Hospital System
1316180748,Great River Medical Center,Mississippi County Hospital System
1245284769,Ouachita County Medical Center,
1154392090,Helena Regional Medical Center,Quorum Health Corporation
1861449639,Mena Regional Health System,
1033160049,St Marys Regional Medical Center (AKA Saint Marys Regional Health System),LifePoint Health (FKA LifePoint Hospitals)
1497790042,Baptist Health Medical Center - North Little Rock,Baptist Health (AR)
1477549756,University of Arkansas for Medical Sciences Medical Center (AKA UAMS),University of Arkansas for Medical Sciences Health (AKA UAMS Health)
1780684431,CHI St Vincent Infirmary,CHI St Vincent (FKA St Vincent Health System)
1861451114,North Metro Medical Center (Closed),Allegiance Health Management
1619926268,John L McClellan Memorial Veterans Hospital,VA South Central VA Health Care Network (VISN 16)
1043240682,Baptist Health Medical Center - Little Rock,Baptist Health (AR)
1942260609,Arkansas Surgical Hospital,Medical Facilities Corporation
1790775229,Arkansas Heart Hospital,Arkansas Heart Hospitals
1629011002,CHI St Vincent North,CHI St Vincent (FKA St Vincent Health System)
1194776757,Arkansas Childrens Hospital,Arkansas Childrens Hospital System
1528360989,St Bernards Five Rivers (FKA Five Rivers Medical Center),St Bernards Healthcare
1811912009,Forrest City Medical Center,Quorum Health Corporation
1235111071,Saline Memorial Hospital (AKA Saline Health System),LifePoint Health (FKA LifePoint Hospitals)
1912978875,Mercy Hospital Waldron (FKA Mercy Hospital Scott County),Mercy (MO)
1578555736,Baptist Health - Fort Smith (FKA Sparks Regional Medical Center),Baptist Health (AR)
1568433480,Mercy Hospital Fort Smith (FKA St Edward Mercy Medical Center),Mercy (MO)
1184612194,De Queen Medical Center (Closed),JCE Healthcare (Closed)
1417913419,Stone County Medical Center,White River Health System
1689625568,South Arkansas Regional Hospital (FKA Medical Center of South Arkansas),
1992760342,Ozark Health Medical Center,
1003867326,Fayetteville VA Medical Center,VA South Central VA Health Care Network (VISN 16)
1407215916,Northwest Health Physicians Specialty Hospital,Northwest Health System
1699726695,Northwest Medical Center - Springdale,Northwest Health System
1083609150,Washington Regional Medical Center,
1962727271,Unity Health - White County Medical Center,Unity Health
1902842255,John Ed Chambers Memorial Hospital,
1235344409,Dardanelle Regional Medical Center (FKA River Valley Medical Center),Conway Regional Health System
1942298153,St Rose Hospital,
1104267848,San Leandro Hospital,Alameda Health System (FKA Alameda County Medical Center)
1780614685,Washington Hospital,
1831529049,Alameda Hospital,Alameda Health System (FKA Alameda County Medical Center)
1144389941,Stanford Health Care - ValleyCare (AKA Stanford Health Care Tri-Valley),Stanford Health Care
1639523004,Alta Bates Summit Medical Center - Alta Bates Campus,Sutter Health
1427123132,Oakland Medical Center,Kaiser Permanente Northern California
1265680045,Laurel Grove Hospital (Closed),
1063812907,Eden Medical Center,Sutter Health
1508138439,Kaiser Permanente - Hayward Medical Center (Closed),Kaiser Permanente Northern California
1447494323,Sutter Amador Hospital,Sutter Health
1417901091,Enloe Medical Center,
1871606269,Oroville Hospital,
1518940667,Adventist Health Feather River (FKA Feather River Hospital - Closed),Adventist Health (AKA Adventist Health System/West)
1508968819,Mark Twain Medical Center,Dignity Health
1215475124,Colusa Medical Center (FKA Colusa Regional Medical Center),American Advanced Management Group (FKA American Specialty Healthcare)
1801821376,John Muir Health - Concord Medical Center,John Muir Health
1124135132,Sutter Delta Medical Center,Sutter Health
1932131489,San Ramon Regional Medical Center,Tenet Healthcare
1851417547,Antioch Medical Center,Kaiser Permanente Northern California
1386719086,Contra Costa Regional Medical Center,
1891733788,Doctors Medical Center - San Pablo (Closed),
1639244262,Walnut Creek Medical Center,Kaiser Permanente Northern California
1740215219,John Muir Health - Walnut Creek Medical Center,John Muir Health
1457367062,Sutter Coast Hospital,Sutter Health
1972503142,Marshall Medical Center,
1003867565,Barton Memorial Hospital (AKA Barton Health),
1336167550,Adventist Health Reedley,Adventist Health Central Valley Network
1104906569,Community Regional Medical Center,Community Medical Centers (AKA the Community Medical Centers Healthcare Network)
1205845567,Saint Agnes Medical Center,Trinity Health (FKA CHE Trinity Health)
1801452941,Coalinga Medical Center (AKA Coalinga Regional Medical Center),American Advanced Management Group (FKA American Specialty Healthcare)
1316027709,Clovis Community Medical Center,Community Medical Centers (AKA the Community Medical Centers Healthcare Network)
1205834694,Fresno Surgical Hospital,United Surgical Partners International (AKA USPI)
1083784672,Fresno Medical Center,Kaiser Permanente Northern California
,Fresno Heart & Surgical Hospital,Community Medical Centers (AKA the Community Medical Centers Healthcare Network)
1336222314,Kingsburg Medical Center (Closed 2010-01-01),
1619929759,Glenn Medical Center,American Advanced Management Group (FKA American Specialty Healthcare)
1003819376,Jerold Phelps Community Hospital,
1043292303,Providence Redwood Memorial Hospital,Providence Health & Services - Northern California (FKA St Joseph Health)
1518996040,Mad River Community Hospital,
1609858950,Providence St Joseph Hospital Eureka,Providence Health & Services - Northern California (FKA St Joseph Health)
1366492738,Martinsburg VA Medical Center,VA Capitol Health Care Network (VISN 5)
1861409823,El Centro Regional Medical Center,University of California San Diego Health System (AKA UC San Diego Health)
1073519443,Pioneers Memorial Hospital (AKA Pioneers Memorial Healthcare District),
1831128602,Southern Inyo Hospital (AKA Southern Inyo Healthcare District),
1922198712,Northern Inyo Hospital,
1427049964,Kern Valley Healthcare District,
1275538530,Adventist Health Tehachapi Valley (FKA Tehachapi Hospital),Adventist Health (AKA Adventist Health System/West)
1376623538,Kern Medical (FKA Kern Medical Center),
1104981661,Mercy Hospital Downtown - Bakersfield,Dignity Health
1205852209,Good Samaritan Hospital,
1144237272,Delano Regional Medical Center (AKA Adventist Health Delano),Adventist Health (AKA Adventist Health System/West)
1609856947,Bakersfield Heart Hospital,Surgery Partners (FKA Symbion Healthcare)
1447253125,Ridgecrest Regional Hospital,
